id,title,corpus,poster,backdrop
26602,Summer Catch,Summer Catch comingofage romantic comedy set backdrop Cape Cod Baseball League Local boy Ryan Dunne Freddie Prinze Jr pitcher Boston College meets Tenley Parrish Jessica Biel daughter wealthy couple summer Cape Ryan Tenley fall love much chagrin families Ryan clings one last hope discovered signed pro baseball contract game beach baseball sport freddieprinzejr jessicabiel fredward miketollin drama comedy romance,/jrygCcE86fISn08jIbBVb5dqwhH.jpg,/5HgxyieEFHyke2aVpwKfQXTHmcB.jpg
15639,Larry the Cable Guy: Health Inspector,Larry Cable Guy Health Inspector slovenly cable repairman becomes bigcity health inspector tasked uncovering source food poisoning epidemic  healthinspector foodintoxication larrythecableguy irisbahr tonyhale trentcooper comedy,/tVyfnRjssOeph5UeFguh8RL8kFo.jpg,/7kznA9UcRXJdFBaKprjTtxp2qG6.jpg
23049,My Life in Ruins,Life Ruins Greek tour guide named Georgia attempts recapture kefi Greek mojo guiding ragtag group tourists around Greece showing beauty native land Along way manages open eyes wonders exotic foreign land beginning see world new set eyes process fun without passport beach greece tourbus niavardalos richarddreyfuss alexisgeorgoulis donaldpetrie comedy romance,/u9UXXbGeUlgBOvUVxASVnFdvuLD.jpg,/4s0AurNfsPuC0M6RdPk12trhb6W.jpg
9310,American Dreamz,American Dreamz new season American Dreamz wildly popular television singing contest captured countrys attention competition looks young Midwestern gal Moore showtunesloving young man Orange County Golzari Recently awakened President Staton Quaid even wants craze signs potential explosive season finale Imagine country people vote pop idol next President usapresident moderator musical hughgrant dennisquaid mandymoore paulweitz comedy drama family,/8d4kXc6jGF078Nsw3qhvnwe5n58.jpg,/mVwHzPqOi5QlviMSDsOy0nEyicI.jpg
4723,Southland Tales,Southland Tales Set futuristic landscape Los Angeles July 4 2008 stands brink social economic environmental disaster Boxer Santaros action star whos stricken amnesia life intertwines Krysta Now adult film star developing reality television project Ronald Taverner Hermosa Beach police officer holds key vast conspiracy nice apocalypse suicide brotherbrotherrelationship spy dwaynejohnson seannwilliamscott sarahmichellegellar richardkelly action adventure comedy,/7dbIDQ80z4bxiDlAvxRwc5TI44C.jpg,/18qSHoHasfgIGOgocU4jm4oiZQP.jpg
4032,My Girl,Girl Vada Sultenfuss obsessed death mother dead father runs funeral parlor also love English teacher joins poetry class summer impress him Thomas J best friend allergic everything sticks Vada despite hangups Vadas father hires Shelly begins fall her things take turn worse Dads undertaker Moms heaven Grandmas got screw looseits good friend understands you Even boy neighbor childkilledbyanimal writingclass annachlumsky macaulayculkin danaykroyd howardzieff comedy drama family,/qyJJNHteA7BUwQSey05t7qP4vRV.jpg,/xhhIh0Vzs2GH4f3tX35YM2FMjLv.jpg
10760,Sydney White,Sydney White modern retelling Snow White set students freshman year college greek system Freshman year fairytale college romance sorority amandabynes sarapaxton mattlong joenussbaum comedy,/ce3NNmhVZY5NkUe5Y8Je8CciKqf.jpg,/bB2L8pB8Qdy3sd4b94Vw75EUEpo.jpg
8467,Dumb and Dumber,Dumb Dumber Lloyd Harry two men whose stupidity really indescribable Mary beautiful woman loses important suitcase money leaves Aspen two friends who found suitcase decide return her adventures finally get Aspen where using lost money live fight Marys heart one have missing gasstation motel utah jimcarrey jeffdaniels laurenholly bobbyfarrelly comedy,/4LdpBXiCyGKkR8FGHgjKlphrfUc.jpg,/nImPkaVZrljYxkYrKGYwSZdf2XC.jpg
639,When Harry Met Sally...,Harry Met Sally travels Chicago New York Harry Sally debate whether sex ruins perfect relationship man woman Eleven years later theyre still closer finding answer two friends sleep together still love morning newyork wifehusbandrelationship restaurant megryan billycrystal carriefisher robreiner comedy romance drama,/3wkbKeowUp1Zpkw1KkBqMWbt0P9.jpg,/kMeDACpkeCBYhWnkrdQvgCsOIgG.jpg
9285,Road Trip,Road Trip Four friends take 1800 mile road trip retrieve illicit tape mistakenly mailed girl friend greatest college tradition all femalenudity sex sexism breckinmeyer seannwilliamscott amysmart toddphillips comedy adventure,/jee4eY5tZprI0V18S6PXUloBzSk.jpg,/ghkFy6CriA1f0OPaCF67byRoazy.jpg
14709,Varsity Blues,Varsity Blues smalltown Texas high school football religion 17yearold schoolboys carry hopes entire community onto gridiron every Friday night star quarterback Lance Harbor suffers injury Coyotes forced regroup questionable leadership John Moxon secondstring quarterback slightly irreverent approach game takes hero know whats worth winning americanfootball smalltown texas jamesvanderbeek amysmart jonvoight brianrobbins comedy drama romance,/C5Pa0WciVH89VBd8gDrQNaeHtZ.jpg,/wRnlzoabjRfsOBo90wWSUpF2wTv.jpg
74643,The Artist,Artist Hollywood 1927 silent movie star George Valentin wonders arrival talking pictures cause fade oblivion sparks Peppy Miller young dancer set big break Breath Fresh Vintage Air filmproducer filmhistory moviestudio jeandujardin bérénicebejo johngoodman michelhazanavicius drama comedy romance,/z68py0ZqPgeacGPG54AGVRbNBS7.jpg,/bYimqNnizPUCnL5HOdoCW02IGmH.jpg
83666,Moonrise Kingdom,Moonrise Kingdom Set island coast New England summer 1965 Moonrise Kingdom tells story two twelveyearolds fall love make secret pact run away together wilderness various authorities try hunt down violent storm brewing offshore – peaceful island community turned upside ways anyone handle tormenting surprising story children adults stormy days summer 1965 newengland firstlove eyepatch brucewillis edwardnorton jaredgilman wesanderson comedy drama romance,/xrziXRHRQ7c7YLIehgSJY8GQBsx.jpg,/bsYv9IFIGfpAV0oUbe7YTiyxhox.jpg
13908,The Master of Disguise,Master Disguise sweetnatured Italian waiter named Pistachio Disguisey father Fabbrizios restaurant happens member family supernatural skills disguise moments later patriarch Disguisey family kidnapped Fabbrizios former archenemy Devlin Bowman criminal mastermind attempt steal worlds precious treasures around world Pistachio track Bowman save family Bowman kills them get disguise getting another story aftercreditsstinger duringcreditsstinger danacarvey brentspiner jenniferesposito perryandelinblake comedy family,/nuP4Ym7vFRj40doQZWwnrsbiCbX.jpg,/gQJh6mw4s6kIhbFs79NNNLeMQ2Z.jpg
39180,See Spot Run,See Spot Run drug sniffing agent canine target assassin boss FBI calls Witness Protection send somewhere else Meanwhile single Mom puts 6 year old boy James care irresponsible mailman neighbor Gordon babysitter bails her Meanwhile assassin mob boss hires 2 goons kill Agent 11 11 escapes van tried kill him hides Gordons Mailtruck James too guess name him Spot Smart One Wearing Pants dog michaelclarkeduncan davidarquette lesliebibb johnwhitesell action comedy family,/29iKqRGRcNqhrT710ohxVq5WwcE.jpg,/7CYcy9eZZdhgBzaHGPH73hrjcNr.jpg
10956,Joe Dirt,Joe Dirt Joe Dirt janitor mullet hairdo acidwashed jeans dream find parents lost Grand Canyon belligerent trailer parkraised eightyearold Now blasting Van Halen jackedup economy car irrepressibly optimistic Joe hits road alone search folks Came Cleaned Conquered parentskidsrelationship lossofparents lookingforbirthparents davidspade brittanydaniel dennismiller denniegordon mystery adventure comedy,/nQoZBpLqGydDjVRXILTx06DoLCF.jpg,/qHytKjIn4WRfwGauPAks4W9Eury.jpg
4638,Hot Fuzz,Hot Fuzz Top London cop PC Nicholas Angel good good stop rest team looking bad reassigned quiet town Sandford paired simple country cop everything seems quiet two actors found decapitated addressed accident Angel going accept that especially people turn dead Big cops Small town Moderate violence village arrest police simonpegg nickfrost jimbroadbent edgarwright crime action comedy,/zPib4ukTSdXvHP9pxGkFCe34f3y.jpg,/e1rPzkIcBEJiAd3piGirt7qVux7.jpg
13972,The Women,Women story centers group gossipy highsociety women spend days beauty salon haunting fashion shows sweet happilywedded Mary Haines finds marriage trouble shop girl Crystal Allen gets hooks Marys man  beautysalon divorce womandirector clorisleachman indiaennenga annettebening dianeenglish comedy drama romance,/iFQrK0NHA4OMAvzyJVW4DA0kAFz.jpg,/lrE14a3NfpDhSHHbJaQYScK6aSh.jpg
10571,Boys and Girls,Boys Girls Ryan Jennifer opposites definitely attract least thats always believed met twelveyearolds disliked one another met teenagers loathed other meet college uptight Ryan freespirited Jennifer find differences bind together rare friendship develops Warning Sex Changes Everything soulmates newlove platoniclove freddieprinzejr claireforlani jasonbiggs robertiscove comedy drama romance,/9zmvYVgcdoXPZQE44gN7nKHScD4.jpg,/kxTDRp8pfhZcIpeihfPWUB9jRDZ.jpg
19994,Jennifer's Body,Jennifers Body newly possessed cheerleader turns killer specializes offing male classmates best friend put end horror evil high school evil bloodthirstiness highschool sexualmurder meganfox amandaseyfried johnnysimmons karynkusama comedy horror,/wrkjsGcFJxcQqR56kJUYAEKKg2T.jpg,/9yEP30ajNWAtAOGvqmxBOIRY260.jpg
25166,Drowning Mona,Drowning Mona recently deceased Mona Dearly Bette Midler many things abusive wife domineering mother loudmouthed neighbor violent malcontent car corpse discovered Hudson River police Chief Wyatt Rash Danny DeVito immediately suspects murder rather accident But since whole community Verplanck NY shares deep hatred unceasingly spiteful woman Rash finds murder investigation overwhelmed potential suspects death Mona Dearly much whodunnit didnt suspicion suspect investigation dannydevito bettemidler nevecampbell nickgomez comedy crime mystery,/iuN2SXCGPIlC7pAPCOzqAdeaDji.jpg,/a7dYlan85gcc8fyMGpPQugsTFXd.jpg
30890,Radio Days,Radio Days Narrator Woody Allen tells us radio influenced childhood days TV New York City late 1930s New Years Eve 1944 comingofage tale mixes narrators experiences contemporary anecdotes urban legends radio stars  beach taxidriver worldwarii woodyallen miafarrow jeffdaniels woodyallen comedy drama,/ljZ3yyYznAiq1vF6nHITdJn6qXB.jpg,/rn3E4Kd7EUOGOF95Hsd0aOhQqZg.jpg
17403,How to Deal,Deal Mandy Moore stars Halley young hip high school student whos convinced true love exist based crazy relationships around her mother divorcing father dating younger woman Halley cant stand crazed sister planning wedding second thoughts best friend fallen madly love first time leaving Halley feel even alone Rule 1 rules womandirector mandymoore trentford allisonjanney clarekilner drama comedy romance,/pD87iTm4MP7JNcxIUssAbpri8nF.jpg,/38SJ5HR1EyvpbTWLRxmPrY469UU.jpg
12120,My Stepmother is an Alien,Stepmother Alien Trying rescue home planet destruction gorgeous extraterrestrial named Celeste arrives Earth begins scientific research woos quirky scientist Dr Steve Mills widower young daughter long Celeste finds love Steve new life Earth experiences true intimacy first time loses sight mission begins question belongs Mans closest encounter alien spoof sneeze danaykroyd kimbasinger jonlovitz richardbenjamin comedy sciencefiction,/o9feh3DGHvNZ835cm2ajYHwZwiN.jpg,/ufEfaCjO8KDFk1frQbueoVd1s8z.jpg
18475,The Cookout,Cookout Todd Anderson signs 30 million deal hometown team New Jersey Nets knows life set big change keep things real decides throw barbeque place  like ones family used have new old friends family agents product reps house things bound get crazy summer get grill on comedy jarule timmeadows jeniferlewis lancerivera comedy drama,/zXOv514vAw57gquad1aP99CHOZ2.jpg,/2kXJImEMeeN1Tmn8fnAXdFeqbEk.jpg
18074,Duets,Duets Duets roadtrip comedy revolves around little known world karaoke whimsical characters inhabit it roads lead Omaha site national karaoke competition motley group singers stars come together blowout singoff Six littles souls search little harmony musical gwynethpaltrow scottspeedman mariabello brucepaltrow comedy drama music,/zfDgSVq8ZDUqvK9w32myXPtX0vK.jpg,/dDJuLVV5K1XYim69Ab8wy9luXu4.jpg
9689,Hollywood Ending,Hollywood Ending Woody Allen stars Val Waxman twotime Oscar winner turned washedup neurotic director desperate need comeback comes Waxman finds backed corner Work exwife Ellie forfeit last shot Val blinded love opts reconnect love blind comes Ellies staunch support Literally figuratively proof picture going shot dark blindnessandimpairedvision creativecrisis filmdirector woodyallen georgehamilton téaleoni woodyallen comedy drama,/3U18987pFdqLzswOQV8Fj2HEunV.jpg,/8U2VFMzc4OpXXt9rXea0aYnBxEq.jpg
9781,Detroit Rock City,Detroit Rock City 1978 Kiss concert epochmaking event three teen fans Detroit Rock City getting tickets soldout show becomes focal point existence Theyll anything tickets  compete strip clubs amateurnight contest take religious protesters even rob convenience store Kiss Rules Goodbye parentskidsrelationship kiss independentfilm giuseppeandrews jamesdebello edwardfurlong adamrifkin comedy music,/jedOctnsD20K4IvOeh5jG811B8L.jpg,/NH15yF3nLKyYpog18sy5ynnGBf.jpg
12657,Soul Plane,Soul Plane Following ridiculously awful flight leads pets death Nashawn Wade files lawsuit airline wins multimilliondollar settlement Determined create better flying experience Nashawn starts airline one caters AfricanAmerican clientele Going business trickedout plane piloted smooth Capt Mack airline hits snag deal family Elvis Hunkee Announcing arrival first airline soul blackpeople hiphop nightclub tomarnold kevinhart methodman jessyterrero romance comedy,/b5Rzb5JUwPinllWGYUYER3OV14F.jpg,/uYppahqnT4n0OlGf1BoeP8ADoS1.jpg
8265,Bienvenue chez les ch'tis,Bienvenue chez les chtis Although living comfortable life SalondeProvence charming town South France Julie feeling depressed while please her Philippe Abrams post office administrator husband tries obtain transfer seaside town French Riviera cost trouble caught redhanded trying scam inspector Philippe immediately banished distant unheard town Bergues Far North France  clocktower jealousy cheating kadmerad danyboon zoéfélix danyboon comedy,/cnUkc60SkI1PCY1SyfLFpZc0T7C.jpg,/sBmLZreEkVK3bc6LLEyZFgKuxjk.jpg
73935,Vamps,Vamps modernday story focuses two beautiful young vampires living good nightlife New York love enters picture make choice jeopardize immortality Dating Sucks vampire love womandirector aliciasilverstone krystenritter sigourneyweaver amyheckerling comedy romance horror,/sW4MFTfW88Ii8TyZVD7oprzzhOU.jpg,/jRfYRzwE4eX1qcnMSTagL1xlxGS.jpg
35696,Juwanna Mann,Juwanna Mann basketball star booted NBA oncourt antics go far poses woman joins WUBA  sport basketball beautifulwoman miguelanúñezjr vivicaafox kevinpollak jessevaughan comedy drama,/hEXQyhJMuqmyZhaPNUGgtm5c8av.jpg,/chmTWdvet7wi2fqHZX58zLredPt.jpg
2110,Wasabi,Wasabi Hubert French policeman sharp methods forced take 2 months boss share view working methods goes back Japan used work 19 years ago settle probate girlfriend left shortly marriage without trace take action raw handcuffs hitman loveletter jeanreno ryokohirosue michelmuller gérardkrawczyk drama action comedy,/z462kVPuD6xpfyTLzoj8AFTx9VR.jpg,/UhLvSGGgiRMWBDqIcLPd6obviK.jpg
9035,Slither,Slither small town taken alien plague turning residents zombies forms mutant monsters Horror New Face smalltown mutant meteor nathanfillion donthompson elizabethbanks jamesgunn comedy horror sciencefiction,/7D4ZS7LUnc89ptIt0yW7L4SYPOG.jpg,/kUpD6EnpnQBi3mjYxmiM4xvuh8g.jpg
90,Beverly Hills Cop,Beverly Hills Cop Toughtalking Detroit cop Axel Foley heads rarified world Beverly Hills beatup Chevy Nova investigate friends murder soon realizes hes stumbled onto something much complicated Bungling rookie detective Billy Rosewood joins fishoutofwater Axel shows West Los Angeles ropes Heat On california showdown undercover eddiemurphy judgereinhold johnashton martinbrest action comedy crime,/eBJEvKkhQ0tUt1dBAcTEYW6kCle.jpg,/tKi5HYDSuxP4I26fxyF2UVvAtLa.jpg
771,Home Alone,Home Alone Eightyearold Kevin McCallister makes situation family unwittingly leaves behind go Christmas vacation pair bungling burglars set sights Kevins house plucky kid stands ready defend territory planting booby traps galore adorably mischievous Kevin stands ground frantic mother attempts race home before Family Comedy Without Family holiday burglar homeinvasion macaulayculkin joepesci danielstern chriscolumbus comedy family,/9wSbe4CwObACCQvaUVhWQyLR5Vz.jpg,/vaVaNrscmsG8CUKYxiwZGFNqGJo.jpg
12154,Three Men and a Baby,Three Men Baby Three bachelors find forced take care baby left one guys girlfriends changed diapers changed lives baby roommate bachelor tomselleck steveguttenberg teddanson leonardnimoy family comedy drama,/oYetboAljWR2N5A7MU3i63DvUtd.jpg,/3A4pvw6x7tf3U7uv3pmPo4Jo1TT.jpg
9576,Tootsie,Tootsie Michael Dorsey unemployed actor impossible reputation order find work fund friends play dresses woman Dorothy Michaels lands part daytime drama Dorsey loses woman role essentially becomes Dorothy Michaels captivating women around city inspiring break free control men become like Dorseys initial identity newfound role however lands Dorsey hot spot female friendlover female costar falls love with costars father falls love him male costar yearns affection get cross hopelessly straight starving actor dynamite red sequined dress get Americas hottest new actress infidelity love friends dustinhoffman jessicalange terigarr sydneypollack comedy romance,/x9cBsqf64j8e5a8PwThT3I6sHFK.jpg,/pPMbp8hNviXiPNIEW98tDxxuzOs.jpg
9493,Twins,Twins Julius Vincent Benedict results experiment would allow perfect child Julius planned grows athletic proportions Vincent accident somewhat smaller stature Vincent placed orphanage Julius taken south seas island raised philosophers Vincent becomes ultimate low life killed loan sharks mother tell apart perfection delivery lowintelligence arnoldschwarzenegger dannydevito kellypreston ivanreitman comedy,/stJx9BQZbXrZnTGf9Erc7d2UMVc.jpg,/vA2KdcJD2Nbg4Y5gYq9RBuOvTTg.jpg
10765,Private Benjamin,Private Benjamin sheltered young high society woman joins army whim finds difficult situation ever expected  paris roleofwomen goldiehawn eileenbrennan armandassante howardzieff comedy,/maIiPNXddZXKHQCi0HyULd5kces.jpg,/wjEHLKQqmWplh4Icy5Q6AbEkalX.jpg
33217,Diary of a Wimpy Kid,Diary Wimpy Kid Greg Heffley headed big things first survive scariest humiliating experience kid’s life – middle school won’t easy considering he’s surrounded hairyfreckled morons wedgieloving bullies moldy slice cheese nuclear cooties diary movie basedonnovel comingofage youngboy zacharygordon robertcapron rachaelharris thorfreudenthal comedy family,/iLAGiPnSuODt9cn332bkFElrRig.jpg,/xEd4sKtyCtm0bnbIwXgWuqZePpl.jpg
11153,National Lampoon's Vacation,National Lampoons Vacation Clark Griswold quest take family quest Walley World theme park vacation things go exactly planned Every summer Chevy Chase takes family little trip year went far usa relatives familyvacation chevychase beverlydangelo imogenecoca haroldramis comedy adventure romance,/q3DvoqY06yZnRp9faH6uge7n7VP.jpg,/2Tn1BO2FscKIvJkAztnPEsZeCHV.jpg
208134,Jackass Presents: Bad Grandpa,Jackass Presents Bad Grandpa 86yearold Irving Zisman journey across America unlikely companion 8 yearold grandson Billy Real people Real reactions Real messed up duringcreditsstinger johnnyknoxville jacksonnicoll georginacates jefftremaine comedy,/dDSMzBEaM0LYSy9Muo0zsCo77Vh.jpg,/pY1t81Lo2ctRX0hGxPvwuFb7RF6.jpg
4011,Beetlejuice,Beetlejuice Thanks untimely demise via drowning young couple end poltergeists New England farmhouse fail meet challenge scaring away insufferable new owners want make drastic changes desperation undead newlyweds turn expert frightmeister hes got diabolical agenda own Hes guaranteed put life afterlife minister giantsnake skeleton geenadavis alecbaldwin winonaryder timburton fantasy comedy,/nnl6OWkyPpuMm595hmAxNW3rZFn.jpg,/sIzZQdXY21sEks9lGkGuXzqdGSA.jpg
17202,Why Did I Get Married?,Get Married film difficulty maintaining solid relationship modern times Eight married college friends plus one nonfriend all achieved middle upper class economic status go Colorado annual weeklong reunion mood shifts one couples infidelity comes light Secrets revealed couple begins question marriage complete others sentences  tylerperry jillscott janetjackson tylerperry comedy drama,/wu4Q3SUxuDDQ0ymcu8MQKlufIXz.jpg,/eM8qR3lOb48oz3SHX6E69npM37a.jpg
11870,Big Fat Liar,Big Fat Liar Fourteenyearold Jason Shepherd Muniz reputation stretching truth So bigtime Hollywood producer Marty Wolf Paul Giamatti steals class paper turns smash movie one believes Jasons latest tall tale crosscountry adventure set record straight Jason best friend Kaylee Bynes devise hightech plan squeeze truth Wolf truth never overrated screenplay filmproducer auto frankiemuniz paulgiamatti amandabynes shawnlevy comedy family,/k1MkctTLNWthU2AUlX4qOCNBlPc.jpg,/3mxZZMXNWz6rNJ8CikOa0IlqmFc.jpg
586,Wag the Dog,Wag Dog final weeks presidential race President accused sexual misconduct distract public election Presidents adviser hires Hollywood producer help stage fake war comedy truth justice special effects washingtondc rape cia dustinhoffman robertdeniro anneheche barrylevinson comedy drama,/kAwOj7t8ZeaniTFtLWVSKO79JxX.jpg,/bWoNwo04ZfZoEvEF8gliyB1EAyS.jpg
18736,The Lizzie McGuire Movie,Lizzie McGuire Movie Lizzie McGuire graduated middle school takes trip Rome Italy risk taking adventure taking all  hilaryduff adamlamberg hallietodd jimfall family comedy,/ctfRTZs6n75KWAmL6kEvct0qSGx.jpg,/hgzX6YBJXI4fvosxvjnPrAmWPNu.jpg
287903,Krampus,Krampus horror comedy based ancient legend pagan creature punishes children Christmas want list fire winter santaclaus adamscott tonicollette allisontolman michaeldougherty horror comedy fantasy,/bm0DzPPIR7mglpgDIxA3Y7AoEk4.jpg,/vpip36rKLNonjYAZkJSPxM5RCn8.jpg
11397,Not Another Teen Movie,Another Teen Movie bet gridiron hero John Hughes High School sets turn bespectacled plain Jane beautiful popular prom queen outrageous sendup teen movie genre served Breakfast gave Pie we’re gonna stuff face underdog ball kiss chylerleigh chrisevans jaimepressly joelgallen comedy,/9ZaGxvj1mqdKVLpSloq4mzS7SK6.jpg,/lyf1jjoMD1Pe7KD6KKEqL4Owgeb.jpg
13411,Malibu's Most Wanted,Malibus Wanted Bill Gluckman wealthy white Jewish senator running office Governor son BRad dresses speaks acts gangster inner city campaign team members hire two actors know innercity life BRad act gang members kidnap him take South Central Los Angeles hope Brad scared white  streetgang losangeles jamiekennedy tayediggs anthonyanderson johnwhitesell comedy crime,/bjYuoz2S8S1AED5QIMvmAi21drc.jpg,/bwkrnryQYBaYNagZoEuuPlOI2UM.jpg
10564,Where the Heart Is,Heart Novalee Nation 17yearold Tennessee transient grow hurry left pregnant abandoned boyfriend roadside Sequoyah Okla takes refuge friendly aisles WalMart short order eccentric kindly strangers adopt Novalee infant daughter helping buck odds build new life Laughter harder Friendship stronger Trust deeper comes heart california baby supermarket natalieportman ashleyjudd stockardchanning mattwilliams comedy drama romance,/2ylEQVilDE1iywh0RlebJmKRGbI.jpg,/ahGSlXunI3Aa0MV4IXlpjYVSVWI.jpg
6961,The Wedding Date,Wedding Date wedding younger sister fast approaching Kat Ellis faces undesirable prospect traveling alone London ceremony bad enough Jeffrey man left moved closer marriage happens grooms best man Determined show everyone  Jeffrey  romantic life full thrilling ever Kat hires charming male escort date Love come cheap basedonnovel callboy wedding debramessing dermotmulroney amyadams clarekilner comedy romance,/t0AEzycJ6V8dLVlSudCUAA9mzgn.jpg,/wi8y24BI9sa8XSnH9vFmmYin6Km.jpg
11132,Confessions of a Teenage Drama Queen,Confessions Teenage Drama Queen teenager Mary Elizabeth Steppe aka Lola moves mother two younger twin sisters New York suburb Dellwood New Jersey feeling cultural entertaining world ended school displaced Lola becomes close friend unpopular Ella also great fan favorite rock band Sidarthur However popular girl school Carla Santini disputes lead role adaptation Pygmalion Lola also leadership mates last concert Sidarthur soldout Lola plans Ella travel New York buy tickets scalpers However girls get trouble helping lead singer Lolas idol Stu Wolf changing lives forever making scene everything rockstar spotlight highschool lindsaylohan adamgarcia glenneheadly sarasugarman comedy,/iDDEeG7cWyZnz2PJmCkCmWL2X5J.jpg,/6MkX9avRe8V61w2rovo4dyxDUBx.jpg
17127,The Object of My Affection,Object Affection pregnant New York social worker begins develop romantic feelings gay best friend decides shed rather raise child him much dismay overbearing boyfriend Sometimes Desirable Relationship One Cant blinddate love fallinginlove jenniferaniston paulrudd haydenpanettiere nicholashytner comedy drama romance,/7LlWOHxcDu0Qsf70LnKwMYV63kb.jpg,/1U8DAdulaZMBqdmr0dDcsSRv1GK.jpg
17880,Because of Winn-Dixie,WinnDixie girl abandoned mother three moves small town Florida father There adopts orphaned dog names WinnDixie bond girl special companion brings together people small Florida town heals troubled relationship father Discover happens go looking miracle miracle comes looking you  jeffdaniels annasophiarobb cicelytyson waynewang comedy drama family,/oMUFS7HmIyTeui5xuoIEkPYTWC8.jpg,/A7DkuH1XcN9DKITdVdpRIwh7aVN.jpg
14736,Love & Basketball,Love  Basketball young AfricanAmerican couple navigates tricky paths romance athletics drama Quincy McCall Omar Epps Monica Wright Sanaa Lathan grew neighborhood known since childhood grow adulthood fall love also share another allconsuming passion basketball Theyve followed game lives small amount talent court Quincy Monica struggle make relationship work follow separate career paths though high school college basketball and hope stardom bigleague professional ball Alls fair love basketball lovers affection sport chriswarrenjr kylapratt sanaalathan ginaprincebythewood action comedy drama,/zNZWNX19FZ5QyedprVM0ldsXFiP.jpg,/cL0GxrBnjgWV381C1NLroeNUcTn.jpg
