id,title,corpus,poster,backdrop
1985,The Constant Gardener,Constant Gardener Justin Quayle lowlevel British diplomat always gone work quietly causing problems radical wife Tessa killed becomes determined find why thrusting middle dangerous conspiracy Love cost aids diplomat nairobi ralphfiennes rachelweisz dannyhuston fernandomeirelles drama mystery thriller,/nkXq7V7mmJVbvwZGr3nxkHo7HkS.jpg,/ksT0nX66UpCVBdvXiXW1byaZtjo.jpg
11024,Scooby-Doo 2: Monsters Unleashed,ScoobyDoo 2 Monsters Unleashed Mystery Inc guests honor grand opening Coolsville Museum Criminology masked villain shows creates havoc stealing costumes gangs notorious villainsCould nemesis mad scientist Jonathan Jacobo returned trying recreate deadliest foes came saw ran detective monster engine freddieprinzejr sarahmichellegellar matthewlillard rajagosnell mystery fantasy adventure,/5BrXCJrs22bR5KR6mLHluYo6y4m.jpg,/m8y7OjvCBLmJfG6CIb5gpXFSLec.jpg
208763,Viy,Viy Early 18th century Cartographer Jonathan Green undertakes scientific voyage Europe East passed Transylvania crossed Carpathian Mountains finds small village lost impassible woods Nothing chance heavy fog could bring cursed place People live resemble people traveler saw that villagers dug deep moat fend rest world share naive belief could save evil failing understand evil made nest souls waiting opportunity gush upon world truth monster mystic church jasonflemyng alekseychadov agniyaditkovskite olegstepchenko thriller adventure mystery,/q0o9JQDp6PHY4zK0Aw1NHpyQyeo.jpg,/qJ2oAceXrc7X1xZB2BDlOBniyi0.jpg
9286,Final Destination 3,Final Destination 3 students premonition deadly rollercoaster ride saves life lucky few death – seeks escaped fate Ride Death You beheading dyinganddeath strokeoffate maryelizabethwinstead ryanmerriman krislemche jameswong horror mystery,/p7ARuNKUGPGvkBiDtIDvAzYzonX.jpg,/upPtpWzVrUD8XPpoHh2CPTRk36o.jpg
11096,Hide and Seek,Hide Seek David Callaway tries piece together life wake wifes suicide left raise nineyearold daughter Emily own David first amused discover Emily created imaginary friend named Charlie long Charlie develops sinister violent side David struggles daughters growing emotional problems comes frightening realisation Charlie figment Emilys imagination Come out come out whatever are house imaginaryfriend suspense robertdeniro dakotafanning famkejanssen johnpolson horror mystery thriller,/orY4PX3TNFdCbdVwhKY32UKMvoA.jpg,/rb72Z88jkQgDZaWvPPnXGvTAmYx.jpg
43931,My Soul to Take,Soul Take serial killer returns hometown stalk seven children share birthday date allegedly put rest One Power Save Souls soul serialkiller slasher maxthieriot johnmagaro denzelwhitaker wescraven drama horror mystery,/aPbR3auoJJ7cvOofQGw4NWm7OTf.jpg,/38zLaycGTVCMyyF9x393ds048JF.jpg
15992,Abandon,Abandon psychological thriller senior one Americas prestigious universities enormous pressure complete thesis earn top job one worlds competitive consulting firms Katie still coping sudden unexplained disappearance first love two years prior investigation continues Katie forced choose past passions new possibilities even new facts uncovered Watch leave behind alcohol detective dancer katieholmes benjaminbratt charliehunnam stephengaghan drama mystery thriller,/7zRmopB7pnveyhFaCRSMZMiGO0v.jpg,/632yGRIcTau6hf5UyZv90HlatYF.jpg
8338,Blindness,Blindness sudden plague blindness devastates city small group afflicted band together triumphantly overcome horrific conditions imposed quarantine  fight blindnessandimpairedvision asylum juliannemoore markruffalo alicebraga fernandomeirelles drama mystery sciencefiction,/deBsx5IxyqCC217j3VY24TkkE0Z.jpg,/sN0czEtCT1jEFQVajWBsKwdFBKm.jpg
9729,Where the Truth Lies,Truth Lies ambitious reporter probes reasons behind sudden split 1950s comedy team  sex journalist journalism kevinbacon colinfirth alisonlohman atomegoyan drama mystery thriller,/4gWQoxAmSeBaugpccnWdlg5Ov6f.jpg,/rMXqN3gXG66W4BzX0AMbpnZN41I.jpg
4233,Scream 2,Scream 2 Two years terrifying events occurred Woodsboro Sidney attending Windsor College Cincinnati Gale Weathers best selling book Sidneys life made major motion picture two college students killed theatre watching new film Stab Sidney knows deep history repeating itself Someone taken love sequels one step far filmfestivals slaughter slasher davidarquette nevecampbell courteneycox wescraven horror mystery,/dORlVasiaDkJXTqt9bdH7nFNs6C.jpg,/dyqmtee83Df1rGwkRo4N8kHHC3i.jpg
3600,I Still Know What You Did Last Summer,Still Know Last Summer Unfinished business coed Julie James brings murderer Bahamas terrorize friends Karla Tyrell Will vacation Ray Bronson survived bloody attack alongside Julie two summers ago get island time save everyone Someone dying second chance competition island radio jenniferlovehewitt freddieprinzejr mekhiphifer dannycannon horror mystery thriller,/motBJIO921LFZkoGKCSbmSCVHBc.jpg,/sn5FydS63DL5KWUBQW3bHhi0Myx.jpg
10866,Joy Ride,Joy Ride Three young people road trip Colorado New Jersey talk trucker CB radio must escape turns psychotic killer joke fun colorado friendship stalker stevezahn paulwalker leeleesobieski johndahl mystery thriller drama,/1LVGjf1QWgkNNPQssZtuT1GYKoP.jpg,/onqQM9YETEcFynO3gZ2kgdI9wIO.jpg
1642,The Net,Net Angela Bennett freelance software engineer lives world computer technology cyber friend asks Bennett debug new game inadvertently becomes involved conspiracy soon turn life upside down vacation Mexico purse stolen soon finds people events may seem becomes target assassination vacation ruined gets new passport US Embassy Mexico wrong name Ruth Marx returns US sort things out discovers Ruth Marx unsavory past lengthy police record make matters worse another person assumed real identity  drivers license credit cards passport access bank accounts foreign country  finds identity stolen cheating newidentity computervirus sandrabullock jeremynortham dennismiller irwinwinkler crime drama mystery,/dtupntUFMD5iXBo8HLfALt2ET4R.jpg,/hPlL6FjbbZGZNfNaBePhOXSB9WY.jpg
270487,"Hail, Caesar!",Hail Caesar Tells comedic tale Eddie Mannix fixer worked Hollywood studios 1950s story finds work star mysteriously disappears middle filming Lights Camera Abduction journalist cat ransom joshbrolin georgeclooney aldenehrenreich joelcoen comedy drama mystery,/txvoksUbyxqvaOvDfEbwW5nEcmX.jpg,/zIUigIht3f9osNGyleF6B3jBbl7.jpg
204922,Before I Go to Sleep,Go Sleep woman wakes every day remembering nothing result traumatic accident past One day new terrifying truths emerge force question everyone around her trust amnesia therapist aggression nicolekidman colinfirth markstrong rowanjoffe mystery thriller,/1sSWpTupVixOanIpZdLGzsKvcZS.jpg,/7bcV1R7z94Jj877I6DQAAFn4L65.jpg
4566,Michael Clayton,Michael Clayton law firm brings fixer remedy situation lawyer breakdown representing chemical company knows guilty multibillion dollar class action suit truth adjusted killing restaurant chambersofabarrister georgeclooney tomwilkinson tildaswinton tonygilroy drama mystery crime,/hhkW4yVIGo8Bee3UITKvqOvhNMG.jpg,/qyFg7CkPSsCrYhn1Wy2w3BRpUTy.jpg
1073,Arlington Road,Arlington Road Threats sinister foreign nationals thing fear Bedraggled college professor Michael Faraday vexed and increasingly paranoid since wifes accidental death botched FBI operation takes backseat seemingly allAmerican couple set house next door Paranoia Real bomb terrorist fbi jeffbridges timrobbins joancusack markpellington drama thriller mystery,/4yYHyZuyTTQaEZuHKS7561jXjtR.jpg,/7qfRbS477Io8JnYz739P0aXbBVh.jpg
49517,Tinker Tailor Soldier Spy,Tinker Tailor Soldier Spy Recentlyretired MI6 agent George Smiley best adjust life outside secret service disgraced agent reappears information concerning mole heart service Smiley drawn back murky field espionage tasked investigating trusted former colleagues chosen betray country Smiley narrows search four suspects – experienced skilled successful agents – past histories rivalries friendships make far easy pinpoint man eating away heart British establishment find enemy hidden right eyes spy coldwar spying johnhurt garyoldman kathyburke tomasalfredson drama thriller mystery,/bsL9UZPCmQKgl88wXwMulKuw9Jh.jpg,/6ZwscHN0bSIueTVTo6mlTGUUP90.jpg
9963,Premonition,Premonition depressed housewife learns husband killed car accident day previously awakens next morning find alive well home awakens day world still dead Reality nightmare away dejavu dyinganddeath timetravel sandrabullock julianmcmahon courtneytaylorburness mennanyapo thriller drama mystery,/vKW1XIYrIqVrbCaYj9FQDHKXR8R.jpg,/esXYvlivZ8j0HGqob949CIjqnGi.jpg
21208,Orphan,Orphan married couple rocky past adopt 9year old Esther fill void created recentlystillborn baby However Esther quite seems keep secret nun deafmute orphan verafarmiga petersarsgaard isabellefuhrman jaumecolletserra horror thriller mystery,/lCGpOgoTOGLtZnBiGY9HRg5Xnjd.jpg,/blJVWug8FJggb9gs6NuooyOWBTP.jpg
14359,Doubt,Doubt 1964 Catholic school nun questions priests ambiguous relationship troubled young student suspecting abuse denies charges much films quickfire dialogue tackles themes religion morality authority evidence witnesses one doubt sexualabuse boy wine merylstreep philipseymourhoffman amyadams johnpatrickshanley drama mystery,/9lypT2ghNuUPYVJf66oe4fKvUqI.jpg,/rQuIeSAEqUyuKP6zAo8m1HgxkRc.jpg
9645,Ghost Ship,Ghost Ship discovering passenger ship missing since 1962 floating adrift Bering Sea salvagers claim vessel own begin towing ghost ship towards harbor series bizarre occurrences happen group becomes trapped inside ship soon learn inhabited demonic creature Sea Evil cruise pilot ghostship gabrielbyrne juliannamargulies desmondharrington stevebeck horror mystery thriller,/o8xH46GiXAFmeFKpIstXJ5FqAL1.jpg,/x8WHhVifVZ5tC5cPuTEBvMZUzSw.jpg
617,Wild Things,Wild Things teensocialite Kelly Van Ryan Richards troubled bad girl Suzie Toller Campbell accuse guidance counselor Sam Lombardo Dillon rape hes suspended school rejected town fighting get life back One cop Bacon suspects conspiracy nothing seems Theyre dying play you upperclass poison sailboat mattdillon kevinbacon deniserichards johnmcnaughton crime drama mystery,/aaicreJBf7EuwGq3GgUV5ZedlfF.jpg,/1Gci6i2RHuum4JaXnlWfev3GH5b.jpg
19904,The Stepfather,Stepfather Michael Harding Penn Badgley returns home military school find mother Sela Ward happily love living new boyfriend David Dylan Walsh two men get know other Michael becomes suspicious man always helpful hand really man dreams could David hiding dark side Daddys home stepfather remake dylanwalsh selaward pennbadgley nelsonmccormick horror thriller mystery,/oKefNCcblde9TK5yBHwArgaKDuf.jpg,/moUN07IWLrz3LL9q0OrkvAjkUx9.jpg
6933,One Missed Call,One Missed Call Several people start receiving voicemails future selves  messages include date time details deaths sound like die candy lossofsister mobilephone shannynsossamon edwardburns anaclaudiatalancón ericvalette horror mystery thriller,/9pIvQaQV0sMHx7d3Ys9qTK9YqTZ.jpg,/t3pSR0WtmGpogFIj8JqBUXQrJbn.jpg
328387,Nerve,Nerve Industrious high school senior Vee Delmonico living life sidelines pressured friends join popular online game Nerve Vee decides sign one dare seems like harmless fun finds caught thrill adrenalinefueled competition partnered mysterious stranger game begins take sinister turn increasingly dangerous acts leading high stakes finale determine entire future watcher player basedonnovel technology internet emmaroberts davefranco emilymeade henryjoost mystery adventure crime,/qmSpHC0CSNyNll9WhlwWYuwoQ28.jpg,/bhClb0sY1rNHrtjfWIhUWTpFCAR.jpg
61012,Silent Hill: Revelation 3D,Silent Hill Revelation 3D Heather Mason father run always one step ahead dangerous forces fully understand eve 18th birthday plagued horrific nightmares disappearance father Heather discovers thinks is revelation leads deeper demonic world threatens trap forever Halloween prepare 3D ride hell femaleprotagonist anotherdimension basedonvideogame adelaideclemens kitharington seanbean michaeljbassett thriller horror mystery,/xBC7bHZ5UglTw4LMd2lTSgXvQXl.jpg,/zhLcgqoIDvxNZPtvQ1PYloGalXs.jpg
290751,Secret in Their Eyes,Secret Eyes tightknit team FBI investigators along District Attorney supervisor suddenly torn apart discover one teenage daughters brutally murdered truth lies unexpected places fbi missingchild chiwetelejiofor nicolekidman juliaroberts billyray crime drama mystery,/gJl4iTxQlazkPCplGmSLGBUwqg9.jpg,/awiTvAC4TGLcdPK7UDXwTd5rjlB.jpg
41402,Let Me In,Let bullied young boy befriends young female vampire lives secrecy guardian remake movie “Let Right One In” adaptation book Innocence dies Abby doesnt vampire childvampire remake kodismitmcphee chloëgracemoretz richardjenkins mattreeves drama horror mystery,/3b5gD5vNmf7Vafj2MN8uMA8r0qu.jpg,/4lyEG56MVUzVhfDV4k7b5d351U1.jpg
10740,Birth,Birth took Anna 10 years recover death husband Sean verge marrying boyfriend Joseph finally moving on However night engagement party young boy named Sean turns up saying dead husband reincarnated first ignores child knowledge former husbands life uncanny leading believe might telling truth careful wish for lossofhusband reincarnation friends nicolekidman cameronbright dannyhuston jonathanglazer drama mystery thriller,/6NY23F5HKQ6PrnBJmSgAK6e4et7.jpg,/qyR72wkksbGWkVGuniCjVF7Mkmq.jpg
46503,All Good Things,Good Things Newlydiscovered facts court records speculation used elaborate true love story murder mystery notorious unsolved murder case New York history perfect love story became perfect crime difficultchildhood patriarch childhoodtrauma kirstendunst ryangosling kristenwiig andrewjarecki drama mystery thriller,/3RM8SyB0yHanJbYeHdgi5eLv21C.jpg,/mP6YfpOBBub03BMKzQssw9GnNgb.jpg
241257,Regression,Regression Minnesota 1990 Detective Bruce Kenner investigates case young Angela accuses father John Gray unspeakable crime John unexpectedly without recollection admits guilt renowned psychologist Dr Raines brought help relive memories discover unmasks horrifying nationwide mystery Fear always finds victim investigation memoryloss ethanhawke emmawatson davidthewlis alejandroamenábar horror mystery thriller,/luHpMTmU1ygtEgdOTSSj0i9nd8E.jpg,/82pIGwRwS0sg1hdSRvKgN5LctOX.jpg
12150,Sea of Love,Sea Love Seenitall New York detective Frank Keller unsettled  done twenty years force could retire come terms wife leaving colleague Joining officer another part town investigate series murders linked lonely hearts columns finds getting seriously possibly dangerously involved Helen one main suspects Deception dangerous Desire deadly newyork alcohol sex alpacino ellenbarkin johngoodman haroldbecker drama crime mystery,/7h88b3F0SUuwtV8QNnzz8d0aHW0.jpg,/8she0UIhlxoUnzWhO5AZpPlL0uf.jpg
4232,Scream,Scream killer known Ghostface begins killing teenagers body count begins rising one girl friends find contemplating rules horror films find living reallife one Someone taken love scary movies one step far halloween gore serialkiller davidarquette nevecampbell courteneycox wescraven crime horror mystery,/3O3klyyYpAZBBE4n7IngzTomRDp.jpg,/8m7Qhs1sZF83YLUBSgDd0tmd46j.jpg
11377,House on Haunted Hill,House Haunted Hill remake 1959 film name millionaire offers group diverse people 1000000 spend night haunted house horrifying past Evil loves party lunaticasylum aftercreditsstinger geoffreyrush famkejanssen tayediggs williammalone horror mystery thriller,/weiGTsZqBglKxkIn5xj1nEjxn81.jpg,/gxZ478weUdq3tiDG348lqlpSE5F.jpg
29427,The Crazies,Crazies Four friends find trapped small hometown discover friends neighbors going quickly horrifically insane Fear Thy Neighbor terror biologicalweapon coverup timothyolyphant radhamitchell joeanderson breckeisner mystery horror action,/ggtG9DZELyTtM2Y0DRJDOJa5iP8.jpg,/6SuxHL3Ug0GfluH9983KkrCSKHo.jpg
5279,Gosford Park,Gosford Park Multiple storylined drama set 1932 showing lives upstairs guest downstairs servants party country house England Tea four Dinner eight Murder midnight servant money shootingparty helenmirren cliveowen maggiesmith robertaltman drama mystery thriller,/7r8DeZuaaHCiOEbkqZC6MFmwJ69.jpg,/mkyqVN51VswajggvNllSDnVf1Cj.jpg
11644,Blow Out,Blow Jack Terry master sound recordist works gradeB horror movies Late one evening recording sounds use movies hears something unexpected sound equipment records it Curiosity gets better media become involved begins unravel pieces nefarious conspiracy struggles survive shadowy enemies expose truth know trust Murder sound own audiotape hitman presidentialelection johntravolta nancyallen johnlithgow briandepalma drama mystery thriller,/weMW1wLzeagP3tw6BfmYf1iL7dz.jpg,/nk87CtgZ7wd86W37oJHGYAJbmLz.jpg
37903,Das weisse Band,Das weisse Band Strange events happen small village north Germany years World War I seem ritual punishment abused suppressed children villagers seem heart mystery  germany childabuse pastor ursinalardi ulrichtukur burghartklaußner michaelhaneke crime drama mystery,/54dlnGDexrwAFlDb8HWKfmmX4LB.jpg,/zUAIDFmjkU7buiGr6q8Ea9MY3G1.jpg
11468,Salton Sea,Salton Sea murder beloved wife man search redemption set adrift world nothing seems journey befriends slacker Jimmy The Finn becomes involved rescuing neighbor Colette demons gets entangled web deceit full unexpected twists turns looking truth come wrong place dualidentity identity warondrugs valkilmer vincentdonofrio adamgoldberg djcaruso drama mystery thriller,/i3InMSlLUNBEdQTKazMdyVP1ryX.jpg,/keHN5s88wrPD3C07n6Lzev0vd69.jpg
1933,The Others,Others Grace religious woman lives old house kept dark two children Anne Nicholas rare sensitivity light family begins suspect house haunted Grace fights protect children cost face strange events disturbing visions Sooner later shell see them everything different nanny hauntedhouse channelislands nicolekidman christophereccleston alakinamann alejandroamenábar horror drama mystery,/p8g1vlTvpM6nr2hMMiZ1fUlKF0D.jpg,/y5hbHJbERDFurustaqcVamN84Y0.jpg
3597,I Know What You Did Last Summer,Know Last Summer celebrate high school graduation four friends involved hitandrun accident car hits apparently kills pedestrian isolated roadway dispose body vow keep incident secret year later somebody starts sending letters bearing warning I Know Last Summer going bury truth make sure stays buried secret blackmail fisherman jenniferlovehewitt sarahmichellegellar ryanphillippe jimgillespie horror thriller mystery,/7OfTWTQEvPcwPrOdeLH0F3h6GRZ.jpg,/tU5CdvDGQRGMfjDIfWmeUKh3ZKk.jpg
18615,Fur: An Imaginary Portrait of Diane Arbus,Fur Imaginary Portrait Diane Arbus 1958 New York Diane Arbus housewife mother works assistant husband photographer employed wealthy parents Respectable though life is cannot help feel uncomfortable privileged world One night new neighbor catches Dianes eye enigmatic man inspires set forth path discovering artistry love story photographer biography hair nicolekidman robertdowneyjr tyburrell stevenshainberg drama mystery romance,/gSd9TtEPrdz39N7WO4Mrfg6eT1z.jpg,/xkyqLhklybD8BnWHOJo22jliJD6.jpg
13788,The Unborn,Unborn young woman fights spirit slowly taking possession her Evil anything live  odetteannable garyoldman meagangood davidsgoyer horror thriller mystery,/6SUuLwyk9wFKZDYsgdSahYs7HEf.jpg,/ek7LZZ6O9o1WKr8oAZ203Jmsm6J.jpg
10956,Joe Dirt,Joe Dirt Joe Dirt janitor mullet hairdo acidwashed jeans dream find parents lost Grand Canyon belligerent trailer parkraised eightyearold Now blasting Van Halen jackedup economy car irrepressibly optimistic Joe hits road alone search folks Came Cleaned Conquered parentskidsrelationship lossofparents lookingforbirthparents davidspade brittanydaniel dennismiller denniegordon mystery adventure comedy,/nQoZBpLqGydDjVRXILTx06DoLCF.jpg,/qHytKjIn4WRfwGauPAks4W9Eury.jpg
25166,Drowning Mona,Drowning Mona recently deceased Mona Dearly Bette Midler many things abusive wife domineering mother loudmouthed neighbor violent malcontent car corpse discovered Hudson River police Chief Wyatt Rash Danny DeVito immediately suspects murder rather accident But since whole community Verplanck NY shares deep hatred unceasingly spiteful woman Rash finds murder investigation overwhelmed potential suspects death Mona Dearly much whodunnit didnt suspicion suspect investigation dannydevito bettemidler nevecampbell nickgomez comedy crime mystery,/iuN2SXCGPIlC7pAPCOzqAdeaDji.jpg,/a7dYlan85gcc8fyMGpPQugsTFXd.jpg
1090,The Thirteenth Floor,Thirteenth Floor Computer scientist Hannon Fuller discovered something extremely important Hes tell discovery colleague Douglas Hall knowing someone him old man leaves letter computer generated parallel world thats like 30s seemingly real people real emotions Question reality go even though exist artificialintelligence simulation computerprogram craigbierko arminmuellerstahl gretchenmol josefrusnak thriller sciencefiction mystery,/7oaie3ZBc9UuWZLF24crro1pone.jpg,/nJ0jz1J3zNja31UEMeklhgFeMw5.jpg
18777,Slow Burn,Slow Burn district attorney Ray Liotta involved 24hour showdown gang leader LL Cool J is time manipulated attractive assistant district attorney Jolene Blalock cryptic stranger truth trick light  rayliotta llcoolj mekhiphifer waynebeach mystery crime drama,/ho43ENDjPpkuMZvBsGTV1STFFik.jpg,/5IxJGuhnI91fZo62JDVV5yM5cbD.jpg
9276,The Faculty,Faculty creepy things start happening around school kids Herrington High make chilling discovery confirms worst suspicions teachers really another planet mindcontrolling parasites rapidly begin spreading faculty students bodies ultimately left – unlikely collection loners leaders nerds jocks – save world alien domination Take teacher americanfootball highschool alien jordanabrewster elijahwood cleaduvall robertrodriguez horror mystery sciencefiction,/l0rz4vB0FfxraTd1mLGoaydSQd1.jpg,/dzFPs6fXRrWIhUhE671lOSCuTnT.jpg
11531,Book of Shadows: Blair Witch 2,Book Shadows Blair Witch 2 Young adults become fascinated events three missing filmmakers Maryland decide go woods find really happened Evil Die witch video forest kimdirector jeffreydonovan ericaleerhsen joeberlinger mystery thriller horror,/l1jF93S9FYbzp3Byh5VUA1KApSJ.jpg,/unVjWj6KsRXk67pEkBfxflpbyRV.jpg
9424,Disturbing Behavior,Disturbing Behavior Steve Clark James Marsden newcomer town Cradle Bay quickly realizes theres something odd high school classmates clique known Blue Ribbons eerie embodiment academic excellence clean living But like rest town theyre little perfect Steves rebellious friend Gavin Nick Stahl mysteriously joins ranks Steve searches truth fellow misfit Rachel Katie Holmes Cradle Bay doesn’t matter you’re perfect be suicide sex island jamesmarsden katieholmes nickstahl davidnutter mystery horror sciencefiction,/lbvTh4l0o5lJgMKnziQELT8M50b.jpg,/9bMAhzkuvwSXdxUIoFrYuAvkxDU.jpg
18681,Eye of the Beholder,Eye Beholder reclusive surveillance expert hired spy mysterious blackmailer may serial killer Obsession eye beholder beautifulwoman serialkiller secretservice ewanmcgregor ashleyjudd patrickbergin stephanelliott drama mystery thriller,/8HqoPlkABscGIUUrv5DBq7SLdKm.jpg,/eh1gdcbzvEw0XVWCWSXZzaXqd9G.jpg
1018,Mulholland Drive,Mulholland Drive car wreck winding Mulholland Drive renders woman amnesic perky Hollywoodhopeful search clues answers across Los Angeles twisting venture beyond dreams reality actress longing star woman searching herself worlds collide Mulholland Drive schizophrenia identity amnesia naomiwatts lauraharring annmiller davidlynch thriller drama mystery,/tVxGt7uffLVhIIcwuldXOMpFBPX.jpg,/y1giivdsGLyo1LCvlsL6mLKyTZ7.jpg
6687,Transsiberian,Transsiberian TransSiberian train journey China Moscow becomes thrilling chase deception murder American couple encounters mysterious pair fellow travelers cant escape lies china marriedcouple backpacker woodyharrelson emilymortimer katemara bradanderson thriller crime mystery,/dhTOda5CLp9tEdDzQZiqBTdv5lR.jpg,/zAA4ySCXAddsKqOKNDvZTjRB3TP.jpg
11190,Возвращение,Возвращение story two Russian boys whose father suddenly returns home 12year absence takes boys holiday remote island lake turns test manhood almost mythic proportions  return brother heavyrain vladimirgarin konstantinlavronenko nataliyavdovina andreyzvyagintsev thriller drama mystery,/7V8iHBs34cPYw7ohpLqliF9x8Gv.jpg,/mn1YEB7D9JLIevqD0ktR1byrVMO.jpg
10185,The Midnight Meat Train,Midnight Meat Train photographer Leon lives girlfriend waitress Maya waiting chance get photo business Maya contacts friend Jurgis schedules meeting Leon successful owner arts gallery Susan Hoff analyzes Leons work asks improve quality photos night upset Leon decides wander streets taking pictures camera follows three punks subway station gang attacks young woman Leon defends guys move on next morning Leon discovers woman missing goes police station Detective Lynn Hadley give much attention discredits statement Leon becomes obsessed find happened stranger watches subway station sees elegant butcher Mahogany train Leon believes might murderer stalks everywhere beginning journey darkness terrifying ride ever take photographer butcher vegetarian bradleycooper vinniejones brookeshields ryûheikitamura mystery drama crime,/x5YbfyUA8huK0shr008xwzNVJ5Y.jpg,/rlFaYFHwUmetf6VhKDIwrYEOeez.jpg
319910,Broken Horses,Broken Horses bonds brotherhood laws loyalty futility violence shadows US Mexico border gang wars   maríavalverde vincentdonofrio thomasjane vidhuvinodchopra thriller mystery drama,/y75BF30IZX2VcU31YAkEdmjhDy6.jpg,
14435,My Bloody Valentine,Bloody Valentine Ten years ago tragedy changed town Harmony forever Tom Hanniger inexperienced coal miner caused accident tunnels trapped killed five men sent survivor Harry Warden permanent coma Harry Warden wanted revenge Exactly one year later Valentine’s Day woke up…and brutally murdered twentytwo people pickaxe killed Hes gonna break heart sheriff miner delusion jensenackles jaimeking kerrsmith patricklussier mystery horror,/9biIVOMTdvv4aj4a5HClmrK5EHB.jpg,/lhYlBOsmwoFlGQg9FmTsS7UMz1K.jpg
