id,title,corpus,poster,backdrop
11863,Jade,Jade Someone nasty hatchet job San Fransisco big noise Assistant DA takes charge investigation web blackmail prostitution involving Governor old lover law man emerges prime suspect deal personal feelings well case fantasies go far callgirl sanfrancisco investigation davidcaruso lindafiorentino chazzpalminteri williamfriedkin action thriller mystery,/lPkDrz6e5DWkKailsx3mIjtq0GF.jpg,/qNJ1oPtENsAUC5fE6MAOtZMriw3.jpg
9481,The Bone Collector,Bone Collector Rookie cop Amelia Donaghy reluctantly teams Lincoln Rhyme – formerly departments top homicide detective paralyzed result spinal injury – catch grisly serial killer dubbed The Bone Collector murderers special signature leave tantalizing clues based grim remains crimes Serial killer vs forensic genius paraplegic investigation psychopath denzelwashington angelinajolie queenlatifah phillipnoyce drama mystery thriller,/4HiIegmRMV147NDLAEhXI8duho.jpg,/hMclNPye6G3ouN5QdusrlTK0SaE.jpg
320,Insomnia,Insomnia Two Los Angeles homicide detectives dispatched northern town sun set investigate methodical murder local teen tough cop brilliant killer unspeakable crime detective confession fbi alpacino robinwilliams hilaryswank christophernolan crime mystery thriller,/riVXh3EimGO0y5dgQxEWPRy5Itg.jpg,/jU8MC5uSgBkZXyZYGtZgMsMsfeN.jpg
10684,Courage Under Fire,Courage Fire US Army officer made friendly fire mistake covered reassigned desk job Later tasked investigate female chopper commanders worthiness awarded Medal Honor posthumously first seemed order begins notice inconsistencies testimonies witnesses medal honor search justice battle truth gulfwar pilot usarmy denzelwashington megryan loudiamondphillips edwardzwick drama thriller mystery,/vDJurMJkrx049AiXa3DJx5Zx7a4.jpg,/51Mr7maI9JaE3pY2CeUSZHTdRas.jpg
9944,The Pelican Brief,Pelican Brief Two Supreme Court Justices assassinated One lone law student stumbled upon truth investigative journalist wants story Everybody else wants dead Two Supreme Court Justices assassinated One lone law student stumbled upon truth investigative journalist wants story Everybody else wants dead judge professor missionofmurder juliaroberts denzelwashington samshepard alanjpakula drama mystery thriller,/1V9B0fk3dh2Af2yUI5mAEETJNNT.jpg,/dMFVSGbgtVTedpewA4PHykQuEEK.jpg
768,From Hell,Hell Frederick Abberline opiumhuffing inspector Scotland Yard falls one Jack Rippers prostitute targets Hughes brothers adaption graphic novel posits Rippers true identity legend survive lossoffamily drugaddiction jacktheripper johnnydepp heathergraham ianholm alberthughes horror mystery thriller,/t2WpWM8nBO4sULXr2bDfNEt4qgr.jpg,/xo2S7gRwCvWdVqM0Swv37yA2rzw.jpg
5955,The Pledge,Pledge police chief retire pledges help woman find daughters killer Based story Swiss writer Friedrich Dürrenmatt  promise murder drawing jacknicholson aaroneckhart helenmirren seanpenn crime drama mystery,/9QOzFL3FPMAUNNPrNiKC3mEDxco.jpg,/o62VYsoyEUYgYMn21Thd9GHTuUE.jpg
11439,The Ghost Writer,Ghost Writer writer stumbles upon longhidden secret agrees help former British Prime Minister Adam Lang complete memoirs remote island politicians assistant drowns mysterious accident director Roman Polanskis tense drama author realizes discovery threatens powerful people anything ensure certain episodes Langs past remain buried Read lies londonengland cia warcrimes ewanmcgregor piercebrosnan jonbernthal romanpolanski thriller mystery,/rK7m2Ba0ieXa37NaAmrx4dfRvvM.jpg,/6YAtj6HK9rHmBRvPL5YgP60Whdq.jpg
37233,The Firm,Firm Mitch McDeere young man promising future Law sit Bar exam approached The Firm made offer refuse Seduced money gifts showered him totally oblivious sinister side company Then two Associates murdered FBI contact him asking information suddenly life ruined choice  work FBI stay Firm Either way lose life knows it Mitch figures way follow plan Power murder resist fbi law tennessee tomcruise jeannetripplehorn genehackman sydneypollack drama mystery thriller,/4YL87D5UEV4c6tqmDkNdo1FJ4xH.jpg,/rB4oTSg3PkH828b3hwn231brzwh.jpg
11560,High Crimes,High Crimes High powered lawyer Claire Kubik finds world turned upside husband thought Tom Kubik arrested revealed Ron Chapman Chapman trial murder Latin American villagers Marines Claire soon learns navigate military justice system shell need help somewhat unconventional Charlie Grimes Everything trust Everything know May lie basedonnovel witness village ashleyjudd morganfreeman jimcaviezel carlfranklin drama mystery thriller,/9sj9rUr7Vu5IfOQHnYKnJuVEw0B.jpg,/lBCV9MT970TtFpYJNCd1HOsT1hE.jpg
2637,The Mothman Prophecies,Mothman Prophecies Reporter John Klein plunged world impossible terror unthinkable chaos fate draws sleepy West Virginia town whose residents visited great winged shape sows hideous nightmares fevered visions see basedonnovel smalltown dream richardgere lauralinney willpatton markpellington drama horror mystery,/z2PiOTyjbCOnMHY2QJdq3I4jU44.jpg,/6FSoZZTwYYrhs5lWdLhj9FCPtT9.jpg
745,The Sixth Sense,Sixth Sense psychological thriller eight year old boy named Cole Sear believes see world dead child psychologist named Malcolm Crowe comes Cole help deal problem learning really see ghosts dead people every gift blessing childabuse senseofguilt lossofchild brucewillis tonicollette oliviawilliams mnightshyamalan mystery thriller drama,/4AfSDjjCy6T5LA1TMz0Lh2HlpRh.jpg,/6TjllWT3cGrPFyqDXurVZ3L8bBi.jpg
10398,Double Jeopardy,Double Jeopardy woman framed husbands murder suspects still alive already tried crime cant reprosecuted finds kills him Murder always crime prison sailboat sailingtrip tommyleejones ashleyjudd brucegreenwood bruceberesford crime drama mystery,/lSYMeHoUh9uWX2kXi9Fqe4BX2Ml.jpg,/fk4NXhazfRKtQaVEV9IPeM7OIVH.jpg
4234,Scream 3,Scream 3 murdering spree begins happen again time targeted toward original Woodsboro survivors associated movie inside movie Stab 3 Sydney must face demons past stop killer Someone taken love trilogies one step far mask metaldetector filmdirector davidarquette nevecampbell courteneycox wescraven horror mystery,/qpH8ToZVlFD1bakL04LkEKodyDI.jpg,/4JOPLgIwDQ1qNI5EHiCF5hPII8Y.jpg
19912,The Final Destination,Final Destination young mans premonition deadly racecar crash helps saves lives peers Death sets collect evaded end Rest Pieces carrace dyinganddeath plan bobbycampo shantelvansanten nickzano davidrellis horror mystery,/5vxXrr1MqGsT4NNeRITpfDnl4Rq.jpg,/6LGX6bPhMEsuwi8CsfSBqnB1qnN.jpg
48138,Unknown,Unknown American biologist attending conference Berlin awakens coma car accident discover someone taken identity one even wife believes him help illegal immigrant former Stazi agent sets prove find people trying kill him Take Back Life taxi hotel coma liamneeson dianekruger januaryjones jaumecolletserra action mystery thriller,/aXBQD515okXQZmYA89ntXMvSJSd.jpg,/f2d419xzKDbtVpToJorTxlKMvgQ.jpg
1124,The Prestige,Prestige mysterious story two magicians whose intense rivalry leads lifelong battle supremacy  full obsession deceit jealousy dangerous deadly consequences Watching Closely competition secret obsession hughjackman christianbale michaelcaine christophernolan drama mystery thriller,/bdN3gXuIZYaJP7ftKK2sU0nPtEA.jpg,/mfJepkInUbiZ0mFXFhDNz8ko6Zr.jpg
1586,Secret Window,Secret Window Mort Rainey writer emerging painful divorce exwife stalked remote lake house psychotic stranger wouldbe scribe claims Rainey swiped best story idea Rainey endeavors prove innocence begins question sanity important part story ending alcohol adultery detective johnnydepp johnturturro timothyhutton davidkoepp thriller mystery,/gvVmdVvJw620TV0EHaynarlKgqQ.jpg,/dBSYDUZpps3LWru7ofUZAYoFgUj.jpg
2044,The Lake House,Lake House lonely doctor occupied unusual lakeside home begins exchanging love letters former resident frustrated architect must try unravel mystery behind extraordinary romance late hold someone never met chicago writing architect keanureeves sandrabullock shohrehaghdashloo alejandroagresti romance drama mystery,/tHpc1118dYWLnHZleGhwZxRbpae.jpg,/afrh3vqLrZeg6ZtKJKm7XW1TiVF.jpg
9913,The Skeleton Key,Skeleton Key hospice nurse working spooky New Orleans plantation home finds entangled mystery involving houses dark past Fearing Believing nurse secret dream katehudson genarowlands petersarsgaard iainsoftley drama horror mystery,/sH7mDPlWwFTqVUg6yKRvToCMH3B.jpg,/uqa4ObNa5Qb38HzIeWi6tyF5aRx.jpg
11831,Amistad,Amistad 1839 slave ship Amistad set sail Cuba America long trip Cinque leads slaves unprecedented uprising held prisoner Connecticut release becomes subject heated debate Freed slave Theodore Joadson wants Cinque others exonerated recruits property lawyer Roger Baldwin help case Eventually John Quincy Adams also becomes ally Freedom given right birth moments must taken cuba mutiny slavery morganfreeman nigelhawthorne anthonyhopkins stevenspielberg drama history mystery,/6QqNyIHKow0jngiQgTNBOBrLILM.jpg,/2lI5rNJeYHShg9okpEXSFzQZqWj.jpg
41446,Scream 4,Scream 4 Sidney Prescott author selfhelp book returns home Woodsboro last stop book tour reconnects Sheriff Dewey Gale married well cousin Jill Aunt Kate Unfortunately Sidneys appearance also brings return Ghostface putting Sidney Gale Dewey along Jill friends whole town Woodsboro danger New Decade New Rules sheriff book knife davidarquette nevecampbell courteneycox wescraven horror mystery,/c2gf4gLMEDKciWZIN2XTYUp2J3m.jpg,/c5EmNhLQsTTKAyUHULnKYQjlloz.jpg
8224,8MM,8MM small seemingly innocuous plastic reel film leads surveillance specialist Tom Welles increasingly dark frightening path help streetwise Max relentlessly follows bizarre trail evidence determine fate complete stranger work turns obsession drifts farther farther away wife family simple life smalltown PI cant prepare truth take you pornography pornactor lossofdaughter nicolascage joaquinphoenix jamesgandolfini joelschumacher thriller crime mystery,/kiIju5GG46DvwoiUs5xlwIyiHMW.jpg,/eEP8pyCmldfbnml0SFMvPK7kE4x.jpg
55779,Final Destination 5,Final Destination 5 fifth installment Death omnipresent ever unleashed one man’s premonition saves group coworkers terrifying suspension bridge collapse group unsuspecting souls never supposed survive and terrifying race time illfated group frantically tries discover way escape Death’s sinister agenda share common destination premonition deathbyaccident crash emmabell nicholasdagosto milesfisher stevenquale horror mystery,/Akx1Po4ZLetOWfYJhQf75tbhTtK.jpg,/5cG2XcylxUIclQsGPBKTtfoqcBV.jpg
13536,City By The Sea,City Sea man struggling come terms sins father makes terrible discovery son fallen life crime drama based true story Vincent LaMarca dedicated wellrespected New York City police detective gone great lengths distance past searching killer last suspect want see son murder homicidedetective robertdeniro jamesfranco francesmcdormand michaelcatonjones crime drama mystery,/vpjKtnE5SGTfmdw4YtJsnrfFJs0.jpg,/kwY1HeoEIDXCdpb4PMdyzCiBUCV.jpg
30943,The Deep End of the Ocean,Deep End Ocean Michelle Pfeiffer ferocious role desperate mother whose 3yearold son disappears high school reunion Nine years later chance turns town family relocated Based Jacquelyn Mitchards bestselling novel an Oprah book club selection movie effectively presents troubling dynamics exist family members whove suffered unsettling loss search son over search family beginning kidnapping boy reunion michellepfeiffer treatwilliams whoopigoldberg ulugrosbard drama mystery,/4Q8g9CfW7EiwxRCpLSDpOmcaEZb.jpg,/idDE0lXV9ZuadIu3dQaqJoiZMFs.jpg
19898,Pandorum,Pandorum Two crew members wake abandoned spacecraft idea are long theyve asleep mission is two soon discover theyre actually alone – reality situation horrifying could imagined fear end world Fear happens next dystopia spaceship survival benfoster dennisquaid camgigandet christianalvart action horror mystery,/tgnKTUsKJ6kM0oqiLmPNePgQ8Sw.jpg,/2M5V8VcK02o4R5cxe7Ew1ltaxKr.jpg
8271,Disturbia,Disturbia Kale 17yearold placed house arrest punching teacher confined house decides use free time spying neighbors Things start get weird guests enter Turners house come back out Kale friends Ronnie Ashley start grow interested actually happening within house Robert Turner quieter street darker secrets kidnapping youngpeople shialabeouf sarahroemer carrieannemoss djcaruso thriller drama mystery,/bJNEBrDy6H4QMHj8GC9OHxPdwJm.jpg,/96GuuOsCRh6IshD6epojkuyvB4p.jpg
622,The Ninth Gate,Ninth Gate allexpensespaid international search rare copy book The Nine Gates Shadow Kingdom brings unscrupulous book dealer deep world murder doubledealing satanic worship Every book life own newyork obsession passionforcollection johnnydepp franklangella lenaolin romanpolanski horror mystery thriller,/iFDtmA8Bg9zE4NcsjcmGfqFN01H.jpg,/en0ZDFc1pqpE5NYOjQhEFYbcaTk.jpg
1091,The Thing,Thing Scientists Antarctic confronted shapeshifting alien assumes appearance people kills Man Warmest Place Hide ice spacemarine paranoia kurtrussell keithdavid wilfordbrimley johncarpenter horror mystery sciencefiction,/tzGY49kseSE9QAKk47uuDGwnSCu.jpg,/fOl0FJ81VoQU0BlRgXA3aVeNlXE.jpg
10871,Switchback,Switchback FBI agent Dennis Quaid tries catch serial killer kidnapped son hunter becomes hunted lossofson serialkiller train dennisquaid dannyglover rleeermey jebstuart action adventure mystery,/elEHm8d9yHYv1ua3hyukPZQjpGi.jpg,/rpI9EYfFhOxjBaJRrnUf32UKNEf.jpg
782,Gattaca,Gattaca Science fiction drama future society era indefinite eugenics humans set life course depending DNA young Vincent Freeman born condition would prevent space travel yet determined infiltrate GATTACA space program gene human spirit paraplegic suicideattempt cheating ethanhawke judelaw gorevidal andrewniccol thriller sciencefiction mystery,/eSKr5Fl1MEC7zpAXaLWBWSBjgJq.jpg,/hPsCR1ny6GnctJkWqeJwihTDD7T.jpg
152,Star Trek: The Motion Picture,Star Trek Motion Picture destructive space entity spotted approaching Earth Admiral Kirk resumes command Starship Enterprise order intercept examine hopefully stop it human adventure beginning artificialintelligence ussenterprise starfleet williamshatner leonardnimoy deforestkelley robertwise sciencefiction adventure mystery,/wfiAfNwH6CMKxz4vRaW8CPTabtk.jpg,/tdEsBRophyizObx5ABwJkOUQHOA.jpg
2118,L.A. Confidential,LA Confidential Three detectives corrupt brutal LA police force 1950s use differing methods uncover conspiracy behind shotgun slayings patrons allnight diner Everything suspect Everyone sale nothing seems corruption detective shotgun kevinspacey guypearce dannydevito curtishanson crime drama mystery,/Rzope4Pk93Rg1Q2Ae8H0FYwa7n.jpg,/fGbM2cqPauRu7ALFPSTDBH9FgpU.jpg
13515,Mirrors,Mirrors excop family target evil force using mirrors gateway home evilOn side schizophrenia nightwatchman subway kiefersutherland paulapatton amysmart alexandreaja horror mystery thriller,/bt5a4ThyLpLTsia2e2ZTLzQjXO0.jpg,/pDjZE6hTt4YN2cC1Z1bYZfmH9bs.jpg
8197,Midnight in the Garden of Good and Evil,Midnight Garden Good Evil visiting city reporters assignment suddenly revolves around murder trial local millionaire befriends  dragqueen voodoo savannah johncusack kevinspacey judelaw clinteastwood crime drama mystery,/wjOZQfffXsNCV18vrXHLm8XUbPn.jpg,/zDtIIaPdcRvZnvpD1qnI8v4nHOR.jpg
8836,The X Files: I Want to Believe,X Files Want Believe Six years events XFiles series finale former FBI agent Doctor Dana Scully staff physician Lady Sorrows Catholic hospital treating boy named Christian Sandhoff disease terminal brain condition FBI agent Drummy arrives ask Scully’s help locating Fox Mulder fugitive former head XFiles division says call manhunt help investigate disappearances several women including young FBI agent Monica Banan Mulder Scully called back duty FBI former priest claims receiving psychic visions pertaining kidnapped agent find truth must believe extraterrestrialtechnology fbi alien davidduchovny gilliananderson amandapeet chriscarter drama mystery sciencefiction,/s3x7CZO7gCICKQkA5rSgorkJzYy.jpg,/mCqcJiTAuI8fFYHwQcwJ4AUCVG9.jpg
59965,Abduction,Abduction young man sets uncover truth life finding baby photo missing persons website stole life Hes taking back cia airport hero taylorlautner lilycollins alfredmolina johnsingleton thriller action mystery,/coL8O01xtvBTT6KsjGteDNglmKJ.jpg,/j9cAc0RldcK7zXmSMbertLMWXg2.jpg
22787,Whiteout,Whiteout US Marshal assigned Antarctica Carrie Stetko soon leave harsh environment behind good – three days sun set AmundsenScott Research Station shut long winter body discovered open ice Carries investigation continents first homicide plunges deep mystery may cost life See Last Breath airplane basedoncomicbook corpse katebeckinsale gabrielmacht tomskerritt dominicsena action crime mystery,/kkXXA3353MX60B8PRSkTGRabxXu.jpg,/iJxz0KK8WNbNLaYrtR70ygND4LJ.jpg
198663,The Maze Runner,Maze Runner Set postapocalyptic world young Thomas deposited community boys memory erased soon learning theyre trapped maze require join forces fellow runners shot escape Run  Remember  Survive basedonnovel maze postapocalyptic dylanobrien kihonglee kayascodelario wesball action mystery sciencefiction,/ode14q7WtDugFDp78fo9lCsmay9.jpg,/vHJlbhsXrZ5yrO2KqCbGSIU6fRX.jpg
10685,The Watcher,Watcher FBI agent Joel Campbell burntout shellshocked years spent chasing serial killers flees LA begin new life Chicago five months later Joels best laid plans abruptly cut short new hometown becomes setting particularly gruesome murdersmurders could committed one man David Allen Griffin One Joels elusive cunning nemeses Griffin followed former pursuer Chicago order play sadistic game cat mouse Taunting Joel photographs intended victims leaving crime scenes meticulously free clues order keep police bay Griffin derives much pleasure watching Joel react every movement watching victims die Griffin moves Joels inner circle Joel must quickly find way stop someone close becomes next one die go home alone chicago fbi menace jamesspader keanureeves marisatomei joecharbanic mystery thriller,/hsMvndtd3KPAvJ3q7zKZuNSB1R3.jpg,/c3KyX7aoEWkyroJXzpexXCyR2T8.jpg
45612,Source Code,Source Code Decorated soldier Captain Colter Stevens wakes body unknown man discovering hes involved mission find bomber Chicago commuter train learns hes part topsecret experimental program enables experience final 8 minutes another persons life Colter relives train incident again gathering clues time discover responsible attack next one happens Make Every Second Count bomb identity fantasy jakegyllenhaal michellemonaghan verafarmiga duncanjones thriller sciencefiction mystery,/AtQDTlj3MFOXJd5C9OopaRo3rRo.jpg,/noHDKhzbwP6DfoaO2xRFLVrpX0N.jpg
3594,The Number 23,Number 23 Walter Sparrow animal control officer becomes obsessed mysterious book seems based life soon opens book notices strange parallels reads hes experienced hes worried fictional murder might materialize First takes hold mindthen takes hold life suicide basedonnovel hotelroom jimcarrey virginiamadsen loganlerman joelschumacher thriller drama mystery,/mlNU8a1SkTu6cKA4LAoZxfNPng0.jpg,/kP2DsgcIwuubm3WBvmxJcWFKzL2.jpg
11313,Hearts in Atlantis,Hearts Atlantis widowed mother son change mysterious stranger enters lives one lifes great mysteries moved upstairs americanfootball billard baseballbat anthonyhopkins antonyelchin hopedavis scotthicks drama mystery,/qPTEh8vutS5FSCDoR16MWVGHqTm.jpg,/sPJ9oRs27CA7NrAa1UnXohKeSpM.jpg
807,Se7en,Se7en Two homicide detectives desperate hunt serial killer whose crimes based seven deadly sins dark haunting film takes viewers tortured remains one victim next seasoned Det Sommerset researches sin effort get inside killers mind novice partner Mills scoffs efforts unravel case Seven deadly sins Seven ways die selffulfillingprophecy detective swat bradpitt morganfreeman gwynethpaltrow davidfincher crime mystery thriller,/6yoghtyTpznpBik8EngEmJskVUO.jpg,/hh28CTWLdxTXA5yJgefZ6gUnFDo.jpg
3489,88 Minutes,88 Minutes 88 Minutes focuses college professor Pacino moonlights forensic psychiatrist FBI receives death threat claiming 88 minutes live 88 minutes solve murder own fbi professor ladiesman alpacino aliciawitt leeleesobieski jonavnet crime mystery thriller,/8rMiBz8kLMNmQyMbQXL9MPIlyw.jpg,/7qE3Zxa2N7GcCLl2EnvnftSJigx.jpg
11208,Wicker Park,Wicker Park Matthew young advertising executive Chicago puts life business trip China hold thinks sees Lisa love life left without word two years earlier walking restaurant one day Passion never dies loveofoneslife leave lookalike joshhartnett rosebyrne matthewlillard paulmcguigan drama mystery romance,/gRKEluSpV1wBrZVTvLLaCSkzqcf.jpg,/mM2z8GxiosnCjk0vJC1Lpv1xysj.jpg
8054,The Imaginarium of Doctor Parnassus,Imaginarium Doctor Parnassus traveling theater company gives audience much expecting  circus immortality elderly christopherplummer heathledger johnnydepp terrygilliam adventure fantasy mystery,/frkXs6OkFWxbn4RyykVUnYiD64W.jpg,/vBw4z7l3NI32th7nR34zqRgdvXS.jpg
9667,The Jacket,Jacket military veteran goes journey future foresee death left questions could save life loves Terror new name smoking medicine psychology adrienbrody keiraknightley kriskristofferson johnmaybury drama mystery thriller,/bt89UfRhjAvJDAO9CWJnRFXAN3p.jpg,/xMQBBxvTZLtAqpmGD6o314xkuzC.jpg
2043,Along Came a Spider,Along Came Spider teacher kidnaps girl prestigious school homicide detective Alex Cross takes case teams young security agent Jezzie Flannigan hope finding girl stopping brutal psychopath Every second counts Alex Jezzie attempt track kidnapper spider claims another victim web game far over psychology policeoperation police morganfreeman monicapotter michaelwincott leetamahori crime mystery thriller,/1YtsND7vSNymylnOSzgg3DdVFMB.jpg,/5C6njaciKvyZlKWUrQX7mjdl4D1.jpg
2832,Identity,Identity Complete strangers stranded remote desert motel raging storm soon find target deranged murderer numbers thin out travelers begin turn other tries figure killer is secret lies within weather multiplecharacter scream johncusack rayliotta amandapeet jamesmangold mystery thriller,/bnidwEvWNAVJ3Uco9wWtuzWAfrx.jpg,/7MwDOMrbjrKP3XQ5vw4cgB2DPaF.jpg
9437,Kiss the Girls,Kiss Girls Forensic psychologist Alex Cross travels North Carolina teams escaped kidnap victim Kate McTiernan hunt Casanova serial killer abducts strongwilled women forces submit demands trail leads Los Angeles duo discovers psychopath may working alone Smart Girls Pretty Girls Missing Girls washingtondc coveredinvestigation investigation morganfreeman ashleyjudd caryelwes garyfleder drama mystery thriller,/25h5I3E3ydhazsPDnscWHivq5pn.jpg,/y319VH0gIFie6KEO5L4nHhxxQUw.jpg
2666,Dark City,Dark City man struggles memories past including wife cannot remember nightmarish world sun run beings telekinetic powers seek souls humans world night never ends soul sleep manipulation rufussewell williamhurt kiefersutherland alexproyas mystery sciencefiction,/AdBe2ow8hdlT2aLBYuUjs0Xkqkw.jpg,/bmAzESah8IUNRQX5MqeyUrhE5Pr.jpg
28355,Case 39,Case 39 many years social worker Emily Jenkins believes seen all meets 10yearold Lilith girls cruel parents Emilys worst fears confirmed parents try harm child Emily assumes custody Lilith looks foster family However Emily soon finds dark forces surround seemingly innocent girl tries protect Lilith horrors encounters cases never opened childabuse detective socialworker renéezellweger jodelleferland ianmcshane christianalvart horror mystery thriller,/b16EjFeHd2AwoYXWUne7DA346pU.jpg,/1i1Jfc9e15uRM3fGp7Detsjsapw.jpg
16617,Mindhunters,Mindhunters Trainees FBIs psychological profiling program must put training practice discover killer midst seven elite profilers finding serial killer process elimination own fbi island serialkiller llcoolj jonnyleemiller kathrynmorris rennyharlin mystery thriller crime,/uTTGRvnqCI9ZC7WkyP9u7XRiOaA.jpg,/j30knUpNbspOSehJi5SOJ4wvOVh.jpg
169917,A Walk Among the Tombstones,Walk Among Tombstones Private investigator Matthew Scudder hired drug kingpin find kidnapped murdered wife people afraid wrong things basedonnovel murder mafia liamneeson danstevens davidharbour scottfrank crime drama mystery,/bQTHTZezSudf27mMQtedHf1XpgO.jpg,/isrro0soStk2tSWMsI50lPPhUsU.jpg
9358,Final Destination 2,Final Destination 2 Kimberly violent premonition highway pileup blocks freeway keeping others meant die safeOr they survivors mysteriously start dying Kimberly stop next Death like boomerang keeps coming back ambulance premonition hospital alilarter ajcook michaellandes davidrellis horror mystery,/dg6Tf98InieJSClSKQJTQevYWmB.jpg,/kDejRs8aKRBr1mARSmDNNZqMW3D.jpg
2057,Original Sin,Original Sin young man plunged life subterfuge deceit mistaken identity pursuit femme fatale whose heart never quite within grasp love story  story love women sex cuba angelinajolie antoniobanderas gregoryitzin michaelcristofer drama thriller mystery,/xvTtsdvvVr1NYlVJxWZibzhaEt5.jpg,/yZvCpMjiqbwyJ0RrS9m3SqmELVv.jpg
70436,The Raven,Raven fictionalized account last days Edgar Allan Poes life poet pursuit serial killer whose murders mirror writers stories one stop serial killer man inspired him poison blackmail maskedball johncusack lukeevans aliceeve jamesmcteigue crime thriller mystery,/boE0JFhZRpWLLrKOQE6bCBZGerP.jpg,/JXO3RAMyRTtKc1LdarQnB1GCBm.jpg
2779,The Curse of the Jade Scorpion,Curse Jade Scorpion CW Briggs veteran insurance investigator many successes Betty Ann Fitzgerald new employee company works for task reorganizing office like  least thats think night rest office employees go watch Voltan magician secretly hypnotizes them Love stings hypnosis independentfilm danaykroyd helenhunt woodyallen woodyallen comedy crime mystery,/3dYj4iLdkhJs0GrXSqh9Z1rTOAS.jpg,/vq4vYFV0TWCCovAFLcdZLCo4Qud.jpg
238615,Self/less,Selfless extremely wealthy elderly man dying cancer undergoes radical medical procedure transfers consciousness body healthy young man everything may good seems starts uncover mystery bodys origins secret organization kill keep secrets God Created Man Man Created Immortality lie immortality terminalillness ryanreynolds benkingsley nataliemartinez tarsemsingh sciencefiction mystery thriller,/b03zZZTE17iH6klsInFOlrgfYRN.jpg,/edeAsyMfRYmNmFUIG1WzK7gcM1y.jpg
