id,title,corpus,poster,backdrop
12403,A Perfect Getaway,Perfect Getaway honeymoon newlyweds Cliff Cydney head tropical islands Hawaii journeying paradisaical countryside couple encounters Kale Cleo two disgruntled hitchhikers Nick Gina two wild wellmeaning spirits help guide lush jungles picturesque waterfalls scenic mountainsides quickly give way terror Cliff Cydney learn grisly murder occurred nearby realize theyre followed chance acquaintances suspiciously fit description killers Welcome paradise Enter risk hawaii honeymoon doublemurder millajovovich timothyolyphant stevezahn davidtwohy thriller mystery adventure,/7Rf1vYvUsZlTG3xlDwsktIrKi7K.jpg,/6n1OBsryOT31WTVxJK4RiCZ14St.jpg
18041,Gossip,Gossip beautiful college campus something ugly spread around bit gossip told starting take frightening turn could offended far person side gossip handle embarrassing situation turn on turn you college suspense gossip joshuajackson jamesmarsden katehudson davisguggenheim drama mystery thriller,/1fyQiQyBFlqjeqgT6sAEh5vo4Fe.jpg,/aJCHbwgrrizPSyZTzywSSeLqYQv.jpg
14033,Soul Survivors,Soul Survivors female collage coed freshman involved fatal car crash discovers may survived tragedy becomes caught world living dead sort limbo state real spirit worlds ghosts afterlife want collect her even worse use body transition state enter world  hallucination carcrash death elizadushku melissasagemiller wesbentley stephencarpenter horror mystery thriller,/uWmHhtuEgX7oI0FuWR2oD08HRHD.jpg,/x5IFsaNFSC8i9OTqTYNZHsBZAud.jpg
25208,The Caveman's Valentine,Cavemans Valentine spinetingling visually stunning thriller Academy AwardÂ®nominee Samuel L Jackson Unbreakable Shaft Pulp Fiction delivers fullthrottle performance People Romulus Ledbetter misunderstood musician turned recluse hiding personal demons New York City cave Romulus finds frozen body young drifter tree authorities  including police officer daughter Aunjanne Ellis  claim death accidental Romulus convinced man murdered prominent art photographer David Leppenraub Colm Feore prove hes right everyone thinks hes insane  womandirector samuelljackson colmfeore annmagnuson kasilemmons drama mystery thriller,/xWjoiGvFZPXuBi93reGblvDHIax.jpg,/hEbXPZSxbcMZtUxoArrnc96vgHL.jpg
28211,Chloe,Chloe doctor hires escort seduce husband suspects cheating though unforeseen events put family danger one love lying you far would go find truth toronto lesbian remakeoffrenchfilm juliannemoore liamneeson amandaseyfried atomegoyan drama thriller mystery,/7VC7Q7GvIhEECIU3fiaRf71mxV6.jpg,/olrr24fPn2U6ZwUfGqRb1E3DmRl.jpg
9504,Glengarry Glen Ross,Glengarry Glen Ross Glengarry Glen Ross follows lives four unethical Chicago real estate agents prepared go lengths legal illegal unload undesirable real estate unwilling prospective buyers Lie Cheat Steal day’s work robbery office shop alpacino jacklemmon alecbaldwin jamesfoley crime drama mystery,/zcaEDx8KlVfh4vKfMNLhiSi5Oz4.jpg,/1fFseB3A35TmXVVb9mz6e6bIMZ0.jpg
26688,Sorority Row,Sorority Row five sorority girls inadvertently cause murder one sisters prank gone wrong agree keep matter never speak again get lives proves easier said done graduation mysterious killer goes five anyone knows secret Sisters Theta Pi Dying Keep Secret femalenudity graduation serialkiller rumerwillis brianaevigan jamiechung stewarthendler horror mystery thriller,/rbZU0hrndaubP7ovlmeCf670Ojh.jpg,/5CW346Nh9417CE1GnAJrFxgnZoU.jpg
3049,Ace Ventura: Pet Detective,Ace Ventura Pet Detective Hes Ace Ventura Pet Detective Jim Carrey case find Miami Dolphins missing mascot quarterback Dan Marino goes eyeball eyeball maneating shark stakes Miami Dolphins woos wows ladies Whether hes undercover fire underwater always gets man    beast Hes best is Actually hes one is dolphin mascot privatedetective jimcarrey seanyoung courteneycox tomshadyac comedy mystery,/pqiRuETmuSybfnVZ7qyeoXhQyN1.jpg,/2MDqPMYUmX7DNZ0yIIDCHpyBC7d.jpg
11601,Stir of Echoes,Stir Echoes hypnotized sister law Tom Witzky begins seeing haunting visions girls ghost mystery begins unfold around her every mind door never opened secret obsession paranoia kevinbacon kathrynerbe illeanadouglas davidkoepp horror mystery thriller,/9CyJ5aYF27cITX1WSUTENeP4wBE.jpg,/np2grTwcwnbRRJlWRl6Ou3KaV3S.jpg
286565,Paper Towns,Paper Towns Quentin Jacobsen spent lifetime loving magnificently adventurous Margo Roth Spiegelman afar cracks open window climbs back lifedressed like ninja summoning ingenious campaign revengehe follows allnighter ends new day breaks Q arrives school discover Margo always enigma become mystery Q soon learns cluesand theyre him Urged disconnected path closer gets less Q sees girl thought knew Get Lost Get Found friendship highschool teenager natwolff caradelevingne justicesmith jakeschreier drama mystery romance,/eoF6wYVj1vbrCWjL0rBkdZpgrxS.jpg,/j2LJCbVXPOFr71oHV9izq2OBSyg.jpg
10944,In the Cut,Cut Following gruesome murder young woman neighborhood selfdetermined woman living New York Cityas test limits safetypropels impossibly risky sexual liaison Soon grows increasingly wary motives every man contactand own Everything know desire dead wrong eroticism suspense womandirector megryan markruffalo jenniferjasonleigh janecampion mystery thriller,/c8Xg0yc8UQwDXooffBNLLs2BvQH.jpg,/gyE4uE9DAljHSXFTstTSblSLn2C.jpg
13079,The Life Before Her Eyes,Life Eyes 15th anniversary fatal high school shooting approaches former pupil Diana McFee haunted memories tragedy losing best friend Maureen attack Diana profoundly affected incident  seemingly perfect life shaped events day life change instant instant last forever suspense umathurman evanrachelwood evaamurrimartino vadimperelman thriller drama mystery,/1Kmy4EfYegTyQNQeHZomTWvmFPe.jpg,/crwSXtFrmH3y9IAdzy3JzYVenSj.jpg
10133,Cypher,Cypher unsuspecting disenchanted man finds working spy dangerous highstakes world corporate espionage Quickly getting way overhishead teams mysterious femme fatale Never forget doublelife undercover lie jeremynortham lucyliu nigelbennett vincenzonatali thriller sciencefiction mystery,/cqSvgtox4Ceq79HamAecBq2yS66.jpg,/y1EjQaJojDusoFCzzCLi2BlByA.jpg
22804,Saw VI,Saw VI Special Agent Strahm dead Detective Hoffman emerged unchallenged successor Jigsaws legacy However FBI draws closer Hoffman forced set game motion Jigsaws grand scheme finally understood Game Come Full Circle aftercreditsstinger tobinbell costasmandylor betsyrussell kevingreutert horror mystery,/dd6rdpnBoqlElTSTlaPM1OjFC1k.jpg,/fwHK67F1vFxFXCgGaEDyueNV8n3.jpg
4657,Jindabyne,Jindabyne Stewart Kane Irishman living Australian town Jindabyne fishing trip isolated hill country three men discover body murdered girl river Rather return town immediately continue fishing report gruesome find days later story murder marriage  film things haunt us surface every life lies mystery smalltown fishing malefriendship lauralinney gabrielbyrne deborraleefurness raylawrence crime drama mystery,/AoaHDXOWnX973UllSfobvGfP3xn.jpg,/yFoyZKqe9u9pkik5FxhRtb26n3t.jpg
62,2001: A Space Odyssey,2001 Space Odyssey Humanity finds mysterious object buried beneath lunar surface sets find origins help HAL 9000 worlds advanced super computer epic drama adventure exploration moon jupiter artificialintelligence keirdullea garylockwood williamsylvester stanleykubrick sciencefiction mystery adventure,/ve72VxNqjGM69Uky4WTo2bK6rfq.jpg,/spHgY9GdIK6agLUnPmD0yVn3kcG.jpg
1970,The Grudge,Grudge American nurse Karen Davis moves Tokyo encounters vengeful supernatural spirit known Grudge often possesses victims series horrifying mysterious deaths occur – spirit passing curse onto victim  Karen must find away break spell becomes spirits next victim never forgives never forgets malenudity nurse japanese sarahmichellegellar jasonbehr cleaduvall takashishimizu horror mystery thriller,/7vPAVPKYexQVmvC578wPLn2CGCL.jpg,/3F2BYZy8H74lWUEKfP5lTPFxEq8.jpg
321258,The Boy,Boy nanny working family whose son passed away finds put charge caring lifelike doll couple treat real child Every child needs feel loved suicide england fire laurencohan rupertevans jamesrussell williambrentbell horror mystery thriller,/W4cdvWRHX1cKpod2KeK8WuHAHG.jpg,/mRUW8rmpCS2kH22eihPbbMIbFxU.jpg
44040,Devil,Devil group people trapped elevator realizes devil among them Bad Things Happen Reason claustrophobia trappedinanelevator chrismessina jacobvargas bojananovaković johnerickdowdle horror mystery thriller,/aivXPSi53H95BoUa5njEYso389s.jpg,/3o7hyb55ZzDAMbZ1w3dWK2ZGaLM.jpg
22824,The Fourth Kind,Fourth Kind Since 1960s disproportionate number population around Nome Alaska gone missing Despite FBI investigations disappearances remain mystery Dr Abigail Tyler psychologist may verge blowing unsolved cases wide open when course treating patients finds evidence alien abductions four kinds alien encounters fourth kind abduction brothersisterrelationship wheelchair hypnosis millajovovich willpatton hakeemkaekazim olatundeosunsanmi mystery sciencefiction thriller,/vfnsGUwurUQqlpvArBvUVc9rYXa.jpg,/q7C7PM6ldX8gdMDP8WGnvLt6KLX.jpg
9455,The Corruptor,Corruptor Danny young cop partnered Nick seasoned ethically tainted veteran two try stop gang war Chinatown Danny relies Nick grows increasingly uncomfortable way Nick gets things done cant play rules any newyork lifeanddeath gangwar markwahlberg chowyunfat byronmann jamesfoley action crime mystery,/ab5XxKzpBkpGkEFJq6t0SiQUWgw.jpg,/n9SyYytuvTXXZY6yx9Yu4iPobN2.jpg
328425,The Gift,Gift husband wife try reinvigorate relationship lives threatened friend husbands past holds horrifying secret him sending world tailspin every gift welcome detective stalker gift jasonbateman rebeccahall joeledgerton joeledgerton thriller mystery,/kH3qLP8pn68Xq5XwvmPkCyaAU7W.jpg,/iKzLQg7xzMN3P9I2zE1CGaVPoC9.jpg
11507,Body Double,Body Double losing acting role girlfriend Jake Scully finally catches break gets offered gig housesitting Hollywood Hills peering beautiful homes telescope one night spies gorgeous blonde dancing window witnesses girls murder leads Scully netherworld adult entertainment industry search answers  porn actress Holly Body guide cant believe everything see femalenudity pornography claustrophobia craigwasson melaniegriffith gregghenry briandepalma crime mystery horror,/lRFm5P2AdOGpELwm3HHhmUz6k5I.jpg,/ox1aaFnhoTgZ5f7TjEDhryFfilc.jpg
14283,The Red Violin,Red Violin Spans 300 years life one famed musical instrument winds presentday Montreal auction block Crafted Italian master Bussotti Cecchi 1681 red violin derives unusual color human blood mixed finish legacy violin travels Austria England China Canada leaving beauty tragedy wake  auction violin carlocecchi irenegrazioli anitalaurenzi françoisgirard drama thriller mystery,/dnU8nB2NffHJtMT0vqmrBxruH9n.jpg,/2EVSly7OY3yjobLdNYDIP5qCoQZ.jpg
134371,Atlas Shrugged Part II,Atlas Shrugged Part II global economy brink collapse Brilliant creators artists industrialists continue mysteriously disappear Unemployment risen 24 Gas 42 per gallon Dagny Taggart Vice President Charge Operations Taggart Transcontinental discovered may well answer mounting energy crisis  found abandoned amongst ruins miraculous motor could seemingly power World But motor dead one left decipher secret and someone watching It’s race clock find inventor stop destroyer motor World stopped good motor would power World World whose motor would stopped John Galt John Galt aynrand samanthamathis jasonbeghe esaimorales johnputch drama sciencefiction mystery,/9iwPz9zy1uCP73QMxhNs6gaTTom.jpg,/gh7pgS9iskzlRMWfa8UEeGY6RgA.jpg
47890,Sphinx,Sphinx Egyptologist Erica Baron finds bargained longplanned trip Land Pharoahs  murder theft betrayal love mummys curse Someone hunting tourists season cairo basedonnovel egypt lesleyannedown franklangella mauriceronet franklinjschaffner adventure mystery thriller,/r8vCundiMdlqczcA2uCzbAyDj2N.jpg,/rYzvq0CwDQo3dLyLySegcy73NC9.jpg
252512,While We're Young,Were Young uptight documentary filmmaker wife find lives loosened bit befriending freespirited younger couple Life Never Gets Old fatherinlaw marriage documentaryfilmmaking benstiller naomiwatts adamdriver noahbaumbach comedy drama mystery,/rdYXGeK3OZjBrd2R8A1sSS0Kxcq.jpg,/9JJJOq1YuhUpC3wRgeEYn85UPbi.jpg
9613,Spider,Spider mentally disturbed man takes residence halfway house mind gradually slips back realm created illness replays key part childhood thing worse losing mind finding again secret asylum bedandbreakfastplace ralphfiennes mirandarichardson gabrielbyrne davidcronenberg drama mystery thriller,/zvm4WuYxTiGkRagRqHUey0meRQL.jpg,/j9LCCCMec4M3lYRKFmksfMfTVZq.jpg
12245,The Oxford Murders,Oxford Murders Oxford University professor grad student work together try stop potential series murders seemingly linked mathematical symbols way finding single absolute truth mathematician mathematics oxford elijahwood johnhurt leonorwatling álexdelaiglesia crime mystery thriller,/aPGyZg44eCxccfoaNNbJwTJj66J.jpg,/v91aGneMO7dT45KEbutrY85JMta.jpg
293670,곡성,곡성 stranger arrives little village soon mysterious sickness starts spreading policeman drawn incident forced solve mystery order save daughter Never tempted sex smalltown exorcism kwakdowon hwangjungmin chunwoohee nahongjin horror mystery,/aXlL7yYwpXInhltamtzKQFBG08G.jpg,/hge97XAJgT6977lFTedreLPlZwh.jpg
291081,Red Riding: In the Year of Our Lord 1974,Red Riding Year Lord 1974 Yorkshire 1974 fear mistrust institutionalised police corruption running riot Rookie journalist Eddie Dunford determined search truth increasingly complex maze lies deceit surrounding police investigation series child abductions young Clare Kemplay goes missing Eddie colleague Barry persuade editor let investigate links two similar abductions last decade mutilated body found construction site owned local property magnate Eddie Barry drawn deadly world secrecy intimidation shocking revelations police brutality epic tale murder corruption obsession  andrewgarfield davidmorrissey johnhenshaw julianjarrold thriller mystery crime,/1MGUwUFkcAKawdsT2q88Sdo2vv6.jpg,/cK4zqgIXBFWoaQ5Kmz8GdyHApIv.jpg
11588,The I Inside,Inside Simon Cable wakes hospital bed confused disoriented soon discovers doctors amnesia unable remember last two years life Cable investigates happened slowly pieces together enigmatic past story began ended infidelity amnesia paranoia ryanphillippe sarahpolley piperperabo rolandsusorichter thriller mystery sciencefiction,/6uHG4HpORiTVq2PVT6s5nzvJGzh.jpg,/reKKVrgeaKozpODdLCbhEQAhN0x.jpg
13483,Awake,Awake undergoing heart surgery man experiences phenomenon called ‘anesthetic awareness’ leaves awake paralyzed throughout operation various obstacles present themselves wife must make lifealtering decisions wrestling personal drama Every year one 700 people wake surgery  haydenchristensen jessicaalba terrencehoward jobyharold thriller crime mystery,/jIPIxaBcppLLkygko7tV5yuTIs1.jpg,/nAVntSurtINQNtYPU7ijgCtgz7W.jpg
10885,Shutter,Shutter newly married couple discovers disturbing ghostly images photographs develop tragic accident Fearing manifestations may connected investigate learn mysteries better left unsolved terrifying images ones real japan suicide photographer joshuajackson rachaeltaylor megumiokina masayukiochiai horror mystery thriller,/bft6OyITsxSZuTxu2oJipApLran.jpg,/6siHyNBYQI7ogEwkaxTD3r6xEDJ.jpg
11596,New Nightmare,New Nightmare Freddys back … hes badder ever Nancy historical nemesis man satanic snarl pitchfork fingers discovers new monstrous demon taken Freddys persona Nancy stop new threat time save son One Two Freddys coming you fire kidnapping nightmare heatherlangenkamp robertenglund mikohughes wescraven horror thriller mystery,/eN3UZUYapJ2CJCD9dN0LUZLouKa.jpg,/qusjc74SWvno7g8EeHww3UVfzZp.jpg
30141,The Singing Detective,Singing Detective hospital bed writer suffering skin disease hallucinates musical numbers paranoid plots comes murder seduction betrayal wrote book hes living it  robertdowneyjr robinwright melgibson keithgordon comedy music mystery,/bjkLSHpV294HIllRpHKWkNICs3N.jpg,/hU74yMO9p7UzVvpfCl7rEqA4XPw.jpg
44718,Get Low,Get Low movie spun equal parts folk tale fable reallife legend mysterious 1930s Tennessee hermit famously threw rollicking funeral party still alive Every secret dies somewhere independentfilm billmurray sissyspacek robertduvall aaronschneider comedy drama mystery,/evNXQIY4lXBZCZIQE9QhdBjmAGF.jpg,/zvMMye9YBD7sfcGyBEYSW6Lw4Ts.jpg
1956,Gerry,Gerry Two friends named Gerry become lost desert taking wrong turn attempts find way home lead trouble  desperation highway wilderness caseyaffleck mattdamon gusvansant mystery drama adventure,/g0hbqzUx260AielXSmtCF7vISam.jpg,/zKygzW1zAndqbYRfDC7FTUs495v.jpg
46738,Incendies,Incendies mothers last wishes send twins Jeanne Simon journey Middle East search tangled roots Adapted Wajdi Mouawads acclaimed play Incendies tells powerful moving tale two young adults voyage core deeprooted hatred neverending wars enduring love search began opening mothers will prison middleeast rape lubnaazabal mélissadésormeauxpoulin maximgaudette denisvilleneuve drama war mystery,/dGrSn4SsuC2EMfF7qqq491ukcU.jpg,/jNICaPciTja37SkbSZh4XCsA0Q6.jpg
11033,Dressed to Kill,Dressed Kill mysterious tall blonde woman wearing sunglasses murders one psychiatrists patients prostitute witnessed it Latest Fashion Murder transvestism taxi prostitute michaelcaine angiedickinson nancyallen briandepalma horror mystery thriller,/oy1m5dd44foNrxV8U9l6Walx82V.jpg,/wmHfg56pvzmLCXz5Gs9D7d5rjvG.jpg
347764,Goddess of Love,Goddess Love Enter baroque vortex madness emotionally unstable woman shattered tremendous heartbreak Brian love Venus’ life thought affair another woman begins volatile descent dark side psychosexual insanity Careful Get Close  alexiskendra elizabethsandy mondascott jonknautz mystery drama thriller,/5zrBskQtkPzthObgssDuUTG7hcd.jpg,/pGaTNp5HG6vIWvq1eq50AcuPp7V.jpg
35689,Don McKay,McKay Everything appears offkilter man returns hometown 25 years visit former lover secrets better left buried independentfilm thomashadenchurch elisabethshue melissaleo jakegoldberger crime mystery thriller,/pkziSZ6vmwFnhybgBAM96Q6xKMr.jpg,
837,Videodrome,Videodrome sleazy cableTV programmer begins see life future media spin control unusual fashion acquires new kind programming station First controls mind destroys body suicide tvshow hallucination jameswoods sonjasmits deborahharry davidcronenberg horror mystery sciencefiction,/qqqkiZSU9EBGZ1KiDmfn07S7qvv.jpg,/kIQszOniJOd1ULFUfdk4yDR0W5c.jpg
4997,Wonderland,Wonderland afternoon July 1 1981 Los Angeles police responded distress call Wonderland Avenue discovered grisly quadruple homicide police investigation followed uncovered two versions events leading brutal murders  involving legendary porn actor John Holmes experience versions Sex drugs murder Welcome LA robbery junkie investigation valkilmer dylanmcdermott katebosworth jamescox crime drama mystery,/mfG8S7D4rYeVqvTzjc3D36PAK3R.jpg,/cMgR7kJuHlVfVcfXm7In5zhAf6Z.jpg
77,Memento,Memento Suffering shortterm memory loss head injury Leonard Shelby embarks grim quest find lowlife murdered wife gritty complex thriller packs knots hangmans noose carry plan Shelby snaps Polaroids people places jotting contextual notes backs photos aid search jog memory even tattoos body desperate bid remember memories best forgotten individual insulin tattoo guypearce carrieannemoss joepantoliano christophernolan mystery thriller,/yuNs09hvpHVU1cBTCAk9zxsL2oW.jpg,/q2CtXYjp9IlnfBcPktNkBPsuAEO.jpg
26748,Lone Star,Lone Star skeleton murdered predecessor found Sheriff Sam Deeds unearths many longburied secrets Texas border town John Sayles invites return scene crime sheriff familysecrets neowestern chriscooper matthewmcconaughey elizabethpeña johnsayles drama mystery romance,/lBxY8znsRoqa9Dy2NCe8I6GPsRm.jpg,/jAWu7vxLOIiDwskIXnF8zqtCnRw.jpg
24913,April Fool's Day,April Fools Day group eight college friends gather together island mansion belonging heiress Muffy St John celebrate final year school soon discover hidden secret past revealed soon after turn dead Childish pranks turn bloody battle survival island party murder deborahforeman thomasfwilson lloydberry fredwalton horror mystery,/fxQG0oItdJxn8r43TyKV9ZmcBwW.jpg,/g0pIbOsJQfFt2C4gDXiLdWGMhRE.jpg
16148,Zero Effect,Zero Effect Daryl Zero private investigator Along assistant Steve Arlo solves impossible crimes puzzles Though master investigator working Zero know himself social skills writes bad music drives Arlo crazy latest case Zero must find blackmailing rich executive client tell him why worlds private detective detective blackmail independentfilm billpullman benstiller ryanoneal jakekasdan comedy crime mystery,/yFALvZFwqnh5ESarNoVd5KtizCo.jpg,/y6cZEbWNtdUD6TW7H2M2ShuZcAs.jpg
199933,Atlas Shrugged Part III: Who is John Galt?,Atlas Shrugged Part III John Galt Approaching collapse nations economy quickly eroding crime fear take countryside government continues exert brutal force nations productive mysteriously vanishing  leaving behind wake despair One man answer One woman stands way stop nothing control him Others stop nothing save him swore life swore find him John Galt trilogy aynrand ericallankramer robmorrow stephentobolowsky jamesmanera drama sciencefiction mystery,/wR7NM125F63zxECZKCVMzibkWpZ.jpg,/xGd7vtT9AQAe9uq15GlCaCLKUKo.jpg
141,Donnie Darko,Donnie Darko narrowly escaping bizarre accident troubled teenager plagued visions large bunny rabbit manipulates commit series crimes never go far parentskidsrelationship airplane timetravel jakegyllenhaal jenamalone patrickswayze richardkelly fantasy drama mystery,/3PiQIQzJX2oE8Uw6gjL08BXQRoB.jpg,/msCHK5Kh1YbdZ0zPJ2nzPUhhSN9.jpg
36419,After.Life,AfterLife young woman caught life death funeral director appears gift transitioning dead might intent burying alive Life symptom Death cure wheelchair nightmare funeral liamneeson justinlong christinaricci agnieszkawojtowiczvosloo drama horror mystery,/ty43RTdSBpL3VjBJWeRoKhFg7hF.jpg,/izrShBDbHduPU5YayZBI5ZTgZUy.jpg
34069,Cargo,Cargo story CARGO takes place rusty spacefreighter KASSANDRA way Station 42 young medic LAURA one awake board rest crew lies frozen hibernation sleep 4 months Lauras shift over  spacecolony spacetravel simulatedreality martinrapold annakatharinaschwabroh regulagrauwiller ivanengler thriller mystery sciencefiction,/cZRLGCW5MkMJiuVOdXBcIsUMhFA.jpg,/lLt7UMEHeMNnwLQJow8crCcmVU6.jpg
512,Scoop,Scoop American journalism student London scoops big story begins affair aristocrat incident unfurls perfect man perfect story perfect murder upperclass prostitute journalist scarlettjohansson hughjackman woodyallen woodyallen comedy mystery,/aHvZYoQNRTMrfs46pj64b9GrbaK.jpg,/8qPG3AjLtletf1K4g8iGhKwHQSc.jpg
2370,Topaz,Topaz French intelligence agent becomes embroiled Cold War politics first uncovering events leading 1962 Cuban Missle Crisis back France break international Russian spy ring Hitchcock takes behind actual headlines expose explosive spy scandal century newyork cia cuba frederickstafford danyrobin claudejade alfredhitchcock action drama mystery,/8u7vxykCVZoaxNocLbpstv3IFNK.jpg,/3NSwwxsu8YXIqnGOrfREEsXWkT7.jpg
573,Frenzy,Frenzy serial murderer strangling women necktie London police suspect wrong man ordinary necktie used deadly new twist londonengland rape police jonfinch alecmccowen barryfoster alfredhitchcock crime drama mystery,/4SFvqrlSigAt9tnhXFSMyKeJWQk.jpg,/5NWLgFDwDOsLXs5m0tTuyRm4SKa.jpg
310131,The Witch,Witch New England 1630s William Katherine lead devout Christian life five children homesteading edge impassable wilderness newborn son vanishes crops fail family turns one another Beyond worst fears supernatural evil lurks nearby wood Evil takes many forms witch newengland 17thcentury anyataylorjoy ralphineson katedickie roberteggers mystery horror,/zap5hpFCWSvdWSuPGAQyjUv2wAC.jpg,/zi2oYYNSSv7t44iSt5YrxHX9PYs.jpg
25376,El secreto de sus ojos,El secreto de sus ojos retired legal counselor writes novel hoping find closure one past unresolved homicide cases unreciprocated love superior  still haunt decades later  rape secret writing ricardodarín soledadvillamil pablorago juanjosécampanella crime drama mystery,/dkeAwfZzwL3WvToydE3CXiY80E0.jpg,/fNHCogWhABNAmzk0IFdzQP5XLYj.jpg
20055,The Betrayed,Betrayed Kidnappers force young mother Melissa George recover money stolen shady husband Christian Campbell know could kill her kidnapping revelation murder melissageorge odedfehr christiancampbell amandagusack crime drama mystery,/ypozb9oWIDZZIwDQZo0s7JgMa6K.jpg,/3YUDie8xndNcH7n19wdpGV6MLIp.jpg
39303,02:13,0213 police profiler returned psychiatric leave find caught serial killers rampage Fighting keep buried trauma childhood must confront toofamiliar flesh masks killer leaves faces victims must face demons along killer save small eroding existence Killers Born  Made thriller forensic markthompson markpellegrino teripolo charlesadelman horror thriller mystery,/duqvQOzzjJ4W3yjZIjE10KM8dFw.jpg,/4koaXAZVVEBPYp9QgPsxa1lGjut.jpg
241766,Lords of London,Lords London Tony notorious gangster big problem woken abandoned farmhouse blood shirt memory got there stumbles small town discovers he’s Italian village seems lost time city crime family business wifehusbandrelationship gangster mysteriouskiller glenmurphy raywinstone giovannicapalbo antoniosimoncini crime mystery thriller,/sB6QoN9BlRnXEeN5KXiIuFthjnT.jpg,
13551,The Dead Girl,Dead Girl clues young womans death come together lives seemingly unrelated people begin intersect One life ends Seven others begin prostitute fire newspaper brittanymurphy tonicollette rosebyrne karenmoncrieff mystery drama crime,/wBIn93ZY0Qd3BafjSJYvqgAZu88.jpg,/20z5l7CEwg8aXcHhxfgk2qxlv1f.jpg
805,Rosemary's Baby,Rosemarys Baby young couple moves infamous New York apartment building start family Things become frightening Rosemary begins suspect unborn baby safe around strange neighbors Pray Rosemarys Baby antichrist contemporarysetting laundry miafarrow johncassavetes ruthgordon romanpolanski horror drama mystery,/s8pdaHjxNPLXIA1WjSTWm00RJTz.jpg,/uC0UYhL6MUWgA6axL8Za7oqoTTa.jpg
