id,title,corpus,poster,backdrop
11470,Jason X,Jason X year 2455 Old Earth contaminated planet abandoned centuries  brown world violent storms toxic landmasses poisonous seas Yet humans returned deadly place fled live research ancient rusting artifacts longgone civilizations harmful environment could prove fatal intrepid young explorers landed Old Earth them Friday 13th Jason lives Evil upgrade placesandplanets spacemarine future kanehodder lexadoig chuckcampbell jamesisaac horror sciencefiction,/g50BkeMOO5ZXcT0B9OBGS4VLvBc.jpg,/e1zfnkOBvGBeydFWCXFuTp9o8KW.jpg
97370,Under the Skin,Skin Jonathan Glazers atmospheric visually arresting abstraction stars Scarlett Johansson seductive alien prowls streets Glasgow search prey unsuspecting men fall spell consumed strange liquid pool mysterious seductress preys upon population Scotland malenudity scotland edinburgh scarlettjohansson kryštofhádek paulbrannigan jonathanglazer thriller sciencefiction drama,/55wmcXJIDYITr7JDijJTdvwSaAv.jpg,/sfqnvsK7sG0id3MLNg0FQIgyogu.jpg
1954,The Butterfly Effect,Butterfly Effect young man struggles access sublimated childhood memories finds technique allows travel back past occupy childhood body change history However soon finds every change makes unexpected consequences minor changes huge consequences amnesia chaostheory blackout ashtonkutcher melorawalters amysmart ericbress sciencefiction thriller,/jY0hIz8eolynHqWN8vrTo0cypBI.jpg,/aoL6L4PCn89MHTVyMnmjwBFLmWX.jpg
22345,Baby Geniuses,Baby Geniuses Scientist hold talking superintelligent babies captive things take turn worse mixup occurs baby genius twin Think innocent Think helpless Think again Naps history baby genius toddler kathleenturner christopherlloyd kimcattrall bobclark sciencefiction comedy family,/70EpKntF6KrN2X38oVLCL9e8WBQ.jpg,/QAnuNwYnnttSkBkvUBwQYf8cKD.jpg
5876,The Mist,Mist violent storm dense cloud mist envelops small Maine town trapping artist David Drayton fiveyearold son local grocery store people soon discover mist conceals deadly horrors threaten lives worse sanity Belief divides them mystery surrounds them fear changes everything fathersonrelationship monster supermarket thomasjane marciagayharden laurieholden frankdarabont sciencefiction horror thriller,/1CvJ6diBACKPVGOpcWuY4XPQdqX.jpg,/3WrR2rYX7nHWnBhWHLZptsJ2bEj.jpg
264660,Ex Machina,Ex Machina Caleb 26 year old coder worlds largest internet company wins competition spend week private mountain retreat belonging Nathan reclusive CEO company Caleb arrives remote location finds participate strange fascinating experiment must interact worlds first true artificial intelligence housed body beautiful robot girl nothing human survive dancing artificialintelligence distrust domhnallgleeson aliciavikander oscarisaac alexgarland drama sciencefiction,/dmJW8IAKHKxFNiUnoDR7JfsK7Rp.jpg,/uqOuJ50EtTj7kkDIXP8LCg7G45D.jpg
238603,Earth to Echo,Earth Echo construction project begins digging neighborhood best friends Tuck Munch Alex inexplicably begin receive strange encoded messages cell phones Convinced something bigger going on go parents authorities everyone around refuses take messages seriously three embark secret adventure crack code follow source taking matters hands gets trio way heads discover mysterious another world desperately needs help epic suspenseful exciting journey follows change lives forever one ever believe story alien foundfootage teohalm astro ressehartwig davegreen family adventure sciencefiction,/yiNPza51nLvVTWTB9q4ifzfUlml.jpg,/xqCU96foxW8w2dhaEhP3vr1Sx4R.jpg
59678,Attack the Block,Attack Block teen gang grim South London housing estate must team residents protect neighbourhood terrifying alien invasion Inner City vs Outer Space streetgang fireworks chase nickfrost jodiewhittaker johnboyega joecornish action comedy sciencefiction,/wzCMnA6NDruLzgWeqMcLPDrGAdF.jpg,/n78A4qGUpXbH0j9QsIKpc2thAv6.jpg
59457,Womb,Womb womans consuming love forces bear clone dead beloved infancy manhood faces unavoidable complexities controversial decision consequences giving birth dead boyfriend  evagreen mattsmith lesleymanville benedekfliegauf romance sciencefiction,/w98sx8jPYWeRZORdmgkmDMcBFuH.jpg,/ozDVHQRk0UU0SYYAan8qF18VGba.jpg
154,Star Trek II: The Wrath of Khan,Star Trek II Wrath Khan Admiral James T Kirk feeling old prospect accompanying old ship Enterprise two week cadet cruise making feel younger training cruise becomes life death struggle Khan escapes years exile captures power creation itself end universe lies beginning vengeance ussenterprise genesis asteroid williamshatner leonardnimoy deforestkelley nicholasmeyer action adventure sciencefiction,/uPyLsKl8Z0LOoxeaFXsY5MxhR5s.jpg,/oXs8kp1oX5N0Mte6U8UUAwmLwt6.jpg
860,WarGames,WarGames High School student David Lightman Matthew Broderick talent hacking trying hack computer system play unreleased video games unwittingly taps Defense Departments war computer initiates confrontation global proportions Together girlfriend Ally Sheedy wizardly computer genius John Wood David must race time outwit opponentand prevent nuclear Armageddon game real videogame artificialintelligence fbi matthewbroderick dabneycoleman allysheedy johnbadham thriller sciencefiction,/zZ1rN4LoPxKNfAp67Xl300WxVeD.jpg,/qtamfYGFfDLfGRcucx1zNwohRts.jpg
76726,Chronicle,Chronicle Three high school students make incredible discovery leading developing uncanny powers beyond understanding learn control abilities use advantage lives start spin control darker sides begin take over capable of seattle telekinesis friendship danedehaan alexrussell michaelbjordan joshtrank sciencefiction drama thriller,/xENglsVIIWEEhhB5lgpy33tGcKI.jpg,/rgNzvSagnlc32TuMEBa529QFIig.jpg
36819,Time Bandits,Time Bandits Young history buff Kevin scarcely believe six dwarfs emerge closet one night Former employees Supreme Being theyve purloined map charting holes fabric time using steal treasures different historical eras Taking Kevin them variously drop Napoleon Robin Hood King Agamemnon Supreme catches them dreams ever good ones treasure map magic seanconnery johncleese shelleyduvall terrygilliam family fantasy sciencefiction,/4VZtpwdhHQSa4LUkvujyGAHb1hG.jpg,/qI64gFiupDsCCgHJqtLE0nHvmE8.jpg
13812,Quarantine,Quarantine television reporter cameraman trapped inside building quarantined CDC outbreak mysterious virus turns humans bloodthirsty killers Contain Truth quarantine remake tvreporter jennifercarpenter steveharris jayhernandez johnerickdowdle horror sciencefiction thriller,/rGfOD8IC1x4PqmnqRuA8KyCckia.jpg,/eBbge8LlrqWGo4MLsH7qXtOrpFi.jpg
31915,Prophecy,Prophecy Savage beast grown monstrous size driven mad toxic wastes poisoning waters spreads terror death Maine countryside  monster mutant toxic taliashire robertfoxworth armandassante johnfrankenheimer horror sciencefiction,/8jCyz5IRWmu8R5FhRO2BqtQXnCj.jpg,/l0Y8RsdPvCfrPZJ483xgUrLBmEe.jpg
122906,About Time,Time night another unsatisfactory New Year party Tims father tells son men family always ability travel time Tim cant change history change happens happened life – decides make world better place getting girlfriend Sadly turns easy thinks every moment life came second chance londonengland fathersonrelationship timetravel domhnallgleeson rachelmcadams billnighy richardcurtis comedy drama sciencefiction,/iR1bVfURbN7r1C46WHFbwCkVve.jpg,/5ZoFGrFCKP0QrcfVwOIHiAwunBg.jpg
227719,Project Almanac,Project Almanac group teens discover secret plans time machine construct one However things start get control Today better second time around timetravel timemachine teenager jonnyweston virginiagardner sofiablackdelia deanisraelite sciencefiction thriller,/r59tzuqi6AoxRKdPHzg3ZBke7aA.jpg,/qJkTb5g154ZwiuHvhO0vc0lSQkL.jpg
12088,Fortress,Fortress futuristic prison movie Protagonist wife nabbed future US emigration point illegal baby population control resulting prison experience subject movie prison futuristic one run private corporation bent mind control various ways hightech prison thirty stories ground Built withstand anything Execpt innocent man prison cyborg marriedcouple christopherlambert kurtwoodsmith lorynlocklin stuartgordon action thriller sciencefiction,/whMDDlgY0AmjMdLuaUDg8XsShWi.jpg,/tPu7eaHFcWCewPuL9ULMC9AoHPr.jpg
1255,괴물,괴물 Gangdu dimwitted man working fathers tiny snack bar near Han River One day Gangdus one daughter Hyunseo comes back school irritated angry uncle Namil visited school guardian shamelessly drunk Ignoring fathers excuses Namil Hyunseo soon engrossed aunt Namjoos archery tournament TV Meanwhile outside snack bar people fascinated unidentified object hanging onto bridge instant object reveals terrifying creature turning riverbank gruesome sea blood¡¦ Amid chaos Hyunseo helplessly snatched creature right Gangdus eyes unforeseen circumstances render government powerless act receiving call help Hyunseo onceordinary citizen Gangdu family thrust battle monster rescue beloved Hyunseo Monsters real river mobilephone bravery songkangho parkhaeil baedoona bongjoonho horror drama sciencefiction,/dEDLY3KeghKFzks5nTDWdigVikr.jpg,/f8lQnoUG0UVK6xXOvfoP0alVJrW.jpg
844,2046,2046 2046 sequel Wong KarWais’ successful boxoffice hit Mood Love film affairs ending relationships shared love KungFu novels main character Chow writes novel reflects back favorite love Su still mood love freelove hotel lovesickness tonyleungchiuwai zhangziyi fayewong wongkarwai fantasy drama sciencefiction,/jIN65qw0Giplo4CshzMrxz204Wn.jpg,/8ASGDbVRdK0UX71fV7oknkquS7k.jpg
10133,Cypher,Cypher unsuspecting disenchanted man finds working spy dangerous highstakes world corporate espionage Quickly getting way overhishead teams mysterious femme fatale Never forget doublelife undercover lie jeremynortham lucyliu nigelbennett vincenzonatali thriller sciencefiction mystery,/cqSvgtox4Ceq79HamAecBq2yS66.jpg,/y1EjQaJojDusoFCzzCLi2BlByA.jpg
61984,Space Battleship Yamato,Space Battleship Yamato 2199 five years Gamilons began invasion Earth planet ravaged aliens bombs remnants humanity fled underground escape irradiated surface One day former pilot Susumu Kodai discovers capsule sent planet Iscandar tells device remove radiation Earths surface Earth Defense Force rebuilds battleship Yamato new type propulsion system make 148000 light year trip Iscandar hopes saving Earth Within one year radiation drive rest humanity extinction   hiroyukiikeuchi takuyakimura meisakuroki takashiyamazaki sciencefiction,/rcpMcrJ2NE2g3aGzBFfpkAEOjhP.jpg,/xaQhFVDeWf78FzZw214yU42w0YZ.jpg
11,Star Wars,Star Wars Princess Leia captured held hostage evil Imperial forces effort take galactic Empire Venturesome Luke Skywalker dashing captain Han Solo team together loveable robot duo R2D2 C3PO rescue beautiful princess restore peace justice Empire long time ago galaxy far far away android galaxy hermit markhamill harrisonford carriefisher georgelucas adventure action sciencefiction,/6FfCtAuVAW8XJjZ7eWeLibRLWTw.jpg,/zqkmTXzjkAgXmEWLRsY4UpTWCeo.jpg
10748,St. Trinian's,St Trinians beloved school threatened closure powers fail raise proper funds girls scheme steal priceless painting use profits pull St Trinians red Taking higher education new low solidarity snake exhibit talulahriley ruperteverett gemmaarterton barnabythompson comedy family sciencefiction,/aOVxLigLjkix69vq6iiu0XXPnai.jpg,/1dwHjpzXMx2UEk7TwZcMMZGLCke.jpg
31909,Invaders from Mars,Invaders Mars remake classic 50s SF tale boy tries stop invasion town aliens take minds parents leastliked schoolteacher townspeople aid school nurse boy enlists aid US Marines conquest already begun know theyre here spaceinvasion remake alieninvasion karenblack huntercarson timothybottoms tobehooper sciencefiction,/nrOMXSicPD73gtZjobR38nTFbDT.jpg,/prXg39FFxNgmab46jS5wkNbjQSt.jpg
190847,The Last Days on Mars,Last Days Mars last day first manned mission Mars crew member Tantalus Base believes made astounding discovery – fossilized evidence bacterial life Unwilling let relief crew claims glory disobeys orders pack goes unauthorized expedition collect samples routine excavation turns disaster porous ground collapses falls deep crevice near certain death devastated colleagues attempt recover body However another vanishes start suspect lifeform discovered without danger search life end mars sciencefiction zombie lievschreiber romolagarai eliaskoteas ruairirobinson sciencefiction thriller horror,/kxcQkAhpn8cvJTsU8PXblI5Qq8F.jpg,/zZUuNeCzA5W6YJweyFLxBN6xTHx.jpg
62,2001: A Space Odyssey,2001 Space Odyssey Humanity finds mysterious object buried beneath lunar surface sets find origins help HAL 9000 worlds advanced super computer epic drama adventure exploration moon jupiter artificialintelligence keirdullea garylockwood williamsylvester stanleykubrick sciencefiction mystery adventure,/ve72VxNqjGM69Uky4WTo2bK6rfq.jpg,/spHgY9GdIK6agLUnPmD0yVn3kcG.jpg
601,E.T. the Extra-Terrestrial,ET ExtraTerrestrial gentle alien becomes stranded Earth discovered befriended young boy named Elliott Bringing extraterrestrial suburban California house Elliott introduces ET alien dubbed brother little sister Gertie children decide keep existence secret Soon however ET falls ill resulting government intervention dire situation Elliott alien afraid alone three million light years home farewell homesickness nasa henrythomas drewbarrymore robertmacnaughton stevenspielberg sciencefiction adventure family,/an0nD6uq6byfxXCfk6lQBzdL2J1.jpg,/9Kg322bGsEbmp94LjCCVGz3cpNw.jpg
1648,Bill & Ted's Excellent Adventure,Bill  Teds Excellent Adventure small town San Dimas miles away Los Angeles two nearly brain dead teenage boys going names Bill S Preston ESQ Ted Theodore Logan dream together starting rock roll band called Wyld Stallyns Unfortunately still high school verge failing school well pass upcoming history report separated result Teds father sending military school But Bill Ted know must stay together save future So man future named Rufus came help pass report So Bill Ted decided gather historical figures need report hoping help pass report stay together History rewritten two guys cant spell jealousy journeyinthepast sigmundfreud keanureeves alexwinter georgecarlin stephenherek adventure comedy sciencefiction,/tV25lGWGWGEqUe3U0xjQTBgilSx.jpg,/9Ac0H6cdbYolC72KXm8N0DwZc2I.jpg
19405,Recess: School's Out,Recess Schools Recess Schools 2001 animated film based Disney television series Recess film produced Walt Disney Pictures released theatrically nationwide February 16 2001Its exciting time year Third Street Elementary end School Year boredom quickly sets protagonist TJ Detweiler friends headed Summer Camp One day passing school bike notices green glow coming schools auditorium work insidious exprincipal Third Street Phillium Benedict gang ninjas secret service lookalikes Benedict planning get rid Summer Vacation using newlyacquired Tractor Beam stole US Military Base effort raise US Test Scores Recess Gang stop him end Saving World One Playground Time holiday elementaryschool friends rickeydshoncollins jasondavis ashleyjohnson chucksheetz sciencefiction animation comedy,/yLdsXdgB2VJ2uBQvYaEB5xPELlq.jpg,/5Sfogeh6PbAZW7hiPV1L2MnQFxV.jpg
9355,Mad Max Beyond Thunderdome,Mad Max Beyond Thunderdome Mad Max becomes pawn decadent oasis technological society exiled becomes deliverer colony children Two men enter One man leaves arena sandstorm dystopia melgibson tinaturner brucespence georgemiller action adventure sciencefiction,/jJlxcEVVUHnrUeEkQ0077VeHQpb.jpg,/br1zDvgmBPa1EbBrUmEDaXXgykq.jpg
10163,The Lawnmower Man,Lawnmower Man simple man turned genius application computer science God made simple Science made god dream chimp manipulation jefffahey piercebrosnan jennywright brettleonard horror thriller sciencefiction,/1VLqWcel87oYVmN383FgSH0mCTY.jpg,/rbPZNYkHOuRTSedWrq1rONVeZvp.jpg
11336,The Dead Zone,Dead Zone Johnny Smith schoolteacher whole life ahead but leaving fiancees home one night involved car crash leaves coma 5 years wakes discovers ability see past present future life anyone comes physical contact mind power see future hands power change it coma sheriff basedonnovel christopherwalken brookeadams tomskerritt davidcronenberg horror sciencefiction thriller,/9yTVaeS8eIkOpbwIycVFm7EQrgF.jpg,/icvgQHxrKEDx92VQ5WHiEmEAUKH.jpg
22824,The Fourth Kind,Fourth Kind Since 1960s disproportionate number population around Nome Alaska gone missing Despite FBI investigations disappearances remain mystery Dr Abigail Tyler psychologist may verge blowing unsolved cases wide open when course treating patients finds evidence alien abductions four kinds alien encounters fourth kind abduction brothersisterrelationship wheelchair hypnosis millajovovich willpatton hakeemkaekazim olatundeosunsanmi mystery sciencefiction thriller,/vfnsGUwurUQqlpvArBvUVc9rYXa.jpg,/q7C7PM6ldX8gdMDP8WGnvLt6KLX.jpg
42684,Skyline,Skyline strange lights descend city Los Angeles people drawn outside like moths flame extraterrestrial force threatens swallow entire human population face Earth band survivors must fight lives world unravels around them look missile light transformation ericbalfour scottiethompson davidzayas colinstrause sciencefiction,/8QpvbnNrtzijlwiM0bFVeilc6lc.jpg,/22RHzAdZDXukBBFewCOT099jZWL.jpg
134371,Atlas Shrugged Part II,Atlas Shrugged Part II global economy brink collapse Brilliant creators artists industrialists continue mysteriously disappear Unemployment risen 24 Gas 42 per gallon Dagny Taggart Vice President Charge Operations Taggart Transcontinental discovered may well answer mounting energy crisis  found abandoned amongst ruins miraculous motor could seemingly power World But motor dead one left decipher secret and someone watching It’s race clock find inventor stop destroyer motor World stopped good motor would power World World whose motor would stopped John Galt John Galt aynrand samanthamathis jasonbeghe esaimorales johnputch drama sciencefiction mystery,/9iwPz9zy1uCP73QMxhNs6gaTTom.jpg,/gh7pgS9iskzlRMWfa8UEeGY6RgA.jpg
32740,कृष,कृष Krishna Roshan born magical powers  legacy father Priya Chopra comes life becomes world beckons Singapore follows Singapore Dr Siddhant Arya Shah megalomaniac scientist verge changing future forever one man stands Dr Siddharth Arya destructive dreams block ruthless ambitions  Krishna must become Krrish   hrithikroshan naseeruddinshah priyankachopra rakeshroshan action sciencefiction,/neJo0Xt9NH6aPBPNhKfHFQpwrcC.jpg,/7yD0xhcx600Ng2XBElVE4eN4bE7.jpg
106845,Re-Kill,ReKill Five years zombie outbreak men women RDivision hunt destroy undead see signs second outbreak fear humanity may survive endangered species realitytv conspiracy zombie rogercross scottadkins daniellaalonso valerimilev horror sciencefiction,/wpofLYUv0aJmDNxyUZux0wTFXJH.jpg,/1kQGVh547uKRQwyEsnmYEsVVhiN.jpg
11827,Heavy Metal,Heavy Metal glowing orb terrorizes young girl collection stories dark fantasy eroticism horror Step Beyond Science Fiction flyingcar taxi heavymetal rodgerbumpass jackieburroughs joeflaherty geraldpotterton animation sciencefiction,/atUtWrDlLzT1yeVK2EoYtvbS963.jpg,/PeeLhvumCVbAoj9qwVr6vClJje.jpg
62215,Melancholia,Melancholia Two sisters find already strained relationship challenged mysterious new planet threatens collide Earth Enjoy lasts weddingreception poweroutage destructionofplanet kirstendunst charlottegainsbourg kiefersutherland larsvontrier drama sciencefiction,/kd0PqvTsJd6DOY7Jxu0R4vEfpsj.jpg,/6XGreAQomYnW7WcbOKvfRFYEW1D.jpg
68684,Detention,Detention killer named Cinderhella stalks student body high school Grizzly Lake group coeds band together survive theyre serving detention Cancel Future highschool murder slasher shanleycaswell joshhutcherson spencerlocke josephkahn horror comedy sciencefiction,/wLuMoe16Z27DH96B2vg4FQNiAjj.jpg,/dIejmkCP46vN5a17u44phOGyAVR.jpg
10179,The Ice Pirates,Ice Pirates time distant future far precious commodity galaxy water last surviving water planet somehow removed unreachable centre galaxy end galactic trade wars galaxy ruled evil emperor John Carradine presiding trade oligarchy controls mining sale ice asteroids comets totally SPACED adventure You see it rebel spacewar water roberturich marycrosby michaeldroberts stewartraffill action sciencefiction comedy,/tv2iZbQYWwKcWOUWVFxOhcchKZT.jpg,/iyZfMe0B1y76BhF0VRgYSxMU8BT.jpg
52010,"Ultramarines: A Warhammer 40,000 Movie",Ultramarines Warhammer 40000 Movie squad Ultramarines answer distress call Imperial Shrine World full Company Imperial Fists stationed there answer them squad investigates find happened there grim darkness far future war  terencestamp johnhurt seanpertwee martynpick animation sciencefiction,/eFfkF9uVqOhAxIKEyNCHfRRdGgj.jpg,/oOBtTgunRkq4xKMoe7DrffHpKIf.jpg
11588,The I Inside,Inside Simon Cable wakes hospital bed confused disoriented soon discovers doctors amnesia unable remember last two years life Cable investigates happened slowly pieces together enigmatic past story began ended infidelity amnesia paranoia ryanphillippe sarahpolley piperperabo rolandsusorichter thriller mystery sciencefiction,/6uHG4HpORiTVq2PVT6s5nzvJGzh.jpg,/reKKVrgeaKozpODdLCbhEQAhN0x.jpg
8069,Barbarella,Barbarella far future highly sexual woman tasked finding stopping evil DurandDurand Along way encounters various unusual people See Barbarella thing sexualfantasy alienplanet distantfuture janefonda johnphilliplaw anitapallenberg rogervadim sciencefiction,/kfaRSR3geV3I65icyHWBBEsE9u.jpg,/wSWE05S7yAbP8yPvE1QSvyHHZXU.jpg
170,28 Days Later,28 Days Later Twentyeight days killer virus accidentally unleashed British research facility small group London survivors caught desperate struggle protect infected Carried animals humans virus turns infects homicidal maniacs  absolutely impossible contain fear began woke alone terror began realised wasnt londonengland manchestercity submachinegun cillianmurphy naomieharris noahhuntley dannyboyle horror thriller sciencefiction,/sQckQRt17VaWbo39GIu0TMOiszq.jpg,/veUl0QT8swshQ9Dz0fQ1k6ZkthD.jpg
149,アキラ,アキラ Childhood friends Tetsuo Kaneda pulled postapocalyptic underworld NeoTokyo forced fight survival Kaneda bike gang leader Tetsuo member tough motorcycle crew becomes involved covert government project called Akira bloody battle ensues Kaneda sets save friend NeoTokyo EXPLODE savingtheworld totaldestruction megacity mitsuoiwata nozomusasaki mamikoyama katsuhiroōtomo sciencefiction animation,/neZ0ykEsPqxamsX6o5QNUFILQrz.jpg,/fK40VGYIm7hmKrLJ26fgPQU0qRG.jpg
21512,The Blood of Heroes,Blood Heroes Set futuristic world sport survived wasted society brutal game known jugging Sallow leader ragtag team played main Leagues before cast indiscretions lady However joined talented newcomer Kidda ambitious young peasant girl team find one last chance glory juggers play one way live  HARD WAY martialarts postapocalyptic sport rutgerhauer joanchen delroylindo davidwebbpeoples action adventure sciencefiction,/hWIDNOsF1yeGTR7jG42VzS1AHmI.jpg,/wvvFqriQZcwFdZsDQCLY5Rh6C7W.jpg
2577,Code 46,Code 46 futuristic Brief Encounter love story romance doomed genetic incompatibility solve crime last thing want know truth seattle shanghai future timrobbins samanthamorton nabilelouahabi michaelwinterbottom drama romance sciencefiction,/ijayvLrCAwOVizi9OY8LZWq5SRW.jpg,/pKZe83X5pwMhpJez4ijmK9EG1GR.jpg
11687,Les visiteurs,Les visiteurs outrageous timetravel comedy follows misadventures wacky medieval knight Jean Reno faithful servant accidentally transported contemporary times senile sorcererMayhem rules 12thcentury visitors try adapting wildly confusing modern world avoid stuck good however soon begin allout cosmic assault former castle  luxury hotel  quest return past Born Yesterday servant timetravel clumsyfellow jeanreno valérielemercier christianclavier jeanmariepoiré fantasy comedy sciencefiction,/hPCq0buG5PaXgKjzT2ktjrjlpbj.jpg,/fQivZouyhRvK72MWHCMb7XvndMC.jpg
110402,Трудно быть богом,Трудно быть богом group scientists sent planet Arkanar help local civilization Medieval phase history find right path progress task difficult one cannot interfere violently case kill scientist Rumata tries save local intellectuals punishment cannot avoid taking position question were would Gods place Directors statement Aleksei wanted make film entire life road long one film cruelty love love there tangible alive resisted hardest conditions   leonidyarmolnik yuriytsurilo natalyamoteva alekseygerman drama sciencefiction,/ivdmKR9K56nxfhWwA5k2UQnyeFK.jpg,/iEOKiQs1Exyuu5eNK3MT8pyen0e.jpg
13001,Stargate: The Ark of Truth,Stargate Ark Truth SG1 searches ancient weapon could help defeat Ori discover may Oris home galaxy Ori prepare send ships Milky Way attack Earth SG1 travels Ori galaxy aboard Odyssey International Oversight committee plans SG1 finds distant galaxy fighting two powerful enemies lines drawn battle waged one thing save us wormhole spacetravel supernaturalpowers benbrowder amandatapping christopherjudge robertccooper adventure sciencefiction,/wsKsWoRxhCuw2dczg1rx9fUAhIp.jpg,/hPHahVM3JDlE0Zexu6avavypk0g.jpg
10514,The Andromeda Strain,Andromeda Strain virtually residents Piedmont New Mexico found dead return Earth space satellite head US Air Forces Project Scoop declares emergency group eminent scientists led Dr Jeremy Stone scramble secure laboratory try first isolate life form determining two people Piedmont  old alcoholic sixmonthold baby  survived scientists methodically study alien life form unaware already mutated presents far greater danger lab equipped nuclear selfdestruct device designed prevent escape dangerous biological agents picture runs 130 minutes story covers 96 critical hours mans history suspense last lifetime nasa newmexico biologicalweapon arthurhill davidwayne jamesolson robertwise sciencefiction thriller,/i3rTxQRJaBJoBcY8VMUOPT2E8Hp.jpg,/dIpTDBXRHmznQ8yZufOo5rucGT9.jpg
