id,title,corpus,poster,backdrop
49529,John Carter,John Carter John Carter warweary former military captain whos inexplicably transported mysterious exotic planet Barsoom Mars reluctantly becomes embroiled epic conflict world brink collapse Carter rediscovers humanity realizes survival Barsoom people rests hands Lost world found another basedonnovel mars medallion taylorkitsch lynncollins samanthamorton andrewstanton action adventure sciencefiction,/lCxz1Yus07QCQQCb6I0Dr3Lmqpx.jpg,/ubNevniKd5NYo60DqYIQ29T0uyB.jpg
99861,Avengers: Age of Ultron,Avengers Age Ultron Tony Stark tries jumpstart dormant peacekeeping program things go awry Earth’s Mightiest Heroes put ultimate test fate planet hangs balance villainous Ultron emerges Avengers stop enacting terrible plans soon uneasy alliances unexpected action pave way epic unique global adventure New Age Come marvelcomic sequel superhero robertdowneyjr chrishemsworth markruffalo josswhedon action adventure sciencefiction,/4ssDuvEDkSArWEdyBl2X5EHvYKU.jpg,/6YwkGolwdOMNpbTOmLjoehlVWs5.jpg
24428,The Avengers,Avengers unexpected enemy emerges threatens global safety security Nick Fury director international peacekeeping agency known SHIELD finds need team pull world back brink disaster Spanning globe daring recruitment effort begins assembly required newyork shield marvelcomic robertdowneyjr chrisevans markruffalo josswhedon sciencefiction action adventure,/RYMX2wcKCBAr24UyPD7xwmjaTn.jpg,/9BBTo63ANSmhC4e6r62OJFuK2GL.jpg
41154,Men in Black 3,Men Black 3 Agents J Will Smith K Tommy Lee Jones backin time J seen inexplicable things 15 years Men Black nothing even aliens perplexes much wry reticent partner Ks life fate planet put stake Agent J travel back time put things right J discovers secrets universe K never told  secrets reveal teams young Agent K Josh Brolin save partner agency future humankind back time timetravel timemachine alien willsmith tommyleejones joshbrolin barrysonnenfeld action comedy sciencefiction,/90DdoEStzeObs96fsYf4GG544iN.jpg,/5AhpUb8CAP0jZ4Wrn7AsRUYjZxB.jpg
271110,Captain America: Civil War,Captain America Civil War Following events Age Ultron collective governments world pass act designed regulate superhuman activity polarizes opinion amongst Avengers causing two factions side Iron Man Captain America causes epic battle former allies Divided Fall civilwar war marvelcomic chrisevans robertdowneyjr scarlettjohansson anthonyrusso adventure action sciencefiction,/rAGiXaUfPzY7CDEyNKUofk3Kw2e.jpg,/wdwcOBMkt3zmPQuEMxB3FUtMio2.jpg
135397,Jurassic World,Jurassic World Twentytwo years events Jurassic Park Isla Nublar features fully functioning dinosaur theme park Jurassic World originally envisioned John Hammond park open ,/A0LZHXUzo5C60Oahvt7VxvwuzHw.jpg,/aIGIYJTyOkEVUmEd3z5x6diYsFx.jpg
68721,Iron Man 3,Iron Man 3 Tony Starks world torn apart formidable terrorist called Mandarin starts odyssey rebuilding retribution Unleash power behind armor terrorist waronterror tennessee robertdowneyjr gwynethpaltrow doncheadle shaneblack action adventure sciencefiction,/qhPtAc1TKbMPqNvcdXSOn9Bn7hZ.jpg,/aFTYFqrWp4RS46Twm87l5e0ItYb.jpg
36668,X-Men: The Last Stand,XMen Last Stand cure found treat mutations lines drawn amongst XMen Brotherhood band powerful mutants organized Xaviers former ally Magneto Take Stand mutant marvelcomic basedoncomicbook hughjackman halleberry ianmckellen brettratner adventure action sciencefiction,/sNSvwqiNXjEvDSeQFsJAGPEP7Gl.jpg,/sBl1n4Oi2wX81EtXIb8NsPqJf3W.jpg
8373,Transformers: Revenge of the Fallen,Transformers Revenge Fallen Sam Witwicky leaves Autobots behind normal life mind filled cryptic symbols Decepticons target dragged back Transformers war Revenge coming egypt sun chaos shialabeouf meganfox joshduhamel michaelbay sciencefiction action adventure,/pLBb0whOzVDtJvyD4DPeQyQNOqp.jpg,/zbdoCe1meTyy0v1fsIxZ9Q0ef3H.jpg
91314,Transformers: Age of Extinction,Transformers Age Extinction humanity picks pieces following conclusion Transformers Dark Moon Autobots Decepticons vanished face planet However group powerful ingenious businessman scientists attempt learn past Transformer incursions push boundaries technology beyond control  ancient powerful Transformer menace sets Earth crosshairs war extinction sequel alien transformers markwahlberg stanleytucci kelseygrammer michaelbay sciencefiction action adventure,/jyzrfx2WaeY60kYZpPYepSjGz4S.jpg,/wxr4Z6E83h14CogsZOzDm1vuDX3.jpg
20526,TRON: Legacy,TRON Legacy Sam Flynn techsavvy daring son Kevin Flynn investigates fathers disappearance pulled Grid help mysterious program named Quorra Sam quests stop evil dictator Clu crossing real world Game Changed artificialintelligence secretidentity computerprogram garretthedlund jeffbridges oliviawilde josephkosinski adventure action sciencefiction,/vuifSABRpSnxCAOxEnWpNbZSXpp.jpg,/zK7wNuUQ4w0QQp9FF20YTPVgpyN.jpg
534,Terminator Salvation,Terminator Salvation grown postapocalyptic 2018 John Connor must lead resistance humans increasingly dominating militaristic robots Marcus Wright appears existence confuses mission Connor tries determine whether Wright come future past  whether hes friend foe End Begins savingtheworld artificialintelligence prophecy christianbale samworthington antonyelchin mcg action sciencefiction thriller,/gw6JhlekZgtKUFlDTezq3j5JEPK.jpg,/5tKiuZvvV1lic7v65rdoGPmoOvf.jpg
54138,Star Trek Into Darkness,Star Trek Darkness crew Enterprise called back home find unstoppable force terror within organization detonated fleet everything stands for leaving world state crisis personal score settle Captain Kirk leads manhunt warzone world capture one man weapon mass destruction heroes propelled epic chess game life death love challenged friendships torn apart sacrifices must made family Kirk left crew Earth Fall spacecraft friendship sequel chrispine zacharyquinto zoesaldana jjabrams action adventure sciencefiction,/7XrRkhMa9lQ71RszzSyVrJVvhyS.jpg,/npDrIM6ZbuD7nUxI7ZzNBxs4IRF.jpg
68726,Pacific Rim,Pacific Rim legions monstrous creatures known Kaiju started rising sea war began would take millions lives consume humanitys resources years end combat giant Kaiju special type weapon devised massive robots called Jaegers controlled simultaneously two pilots whose minds locked neural bridge even Jaegers proving nearly defenseless face relentless Kaiju verge defeat forces defending mankind choice turn two unlikely heroes—a washedup former pilot Charlie Hunnam untested trainee Rinko Kikuchi—who teamed drive legendary seemingly obsolete Jaeger past Together stand mankinds last hope mounting apocalypse Fight Monsters Created Monsters dystopia giantrobot giantmonster idriselba charliehunnam charlieday guillermodeltoro action sciencefiction adventure,/8wo4eN8dWKaKlxhSvBz19uvj8gA.jpg,/ig7qUy7drkEFZNCK7gi0hMn1WMN.jpg
38356,Transformers: Dark of the Moon,Transformers Dark Moon Sam Witwicky takes first tenuous steps adulthood remaining reluctant human ally Autobotleader Optimus Prime film centers around space race USSR USA suggesting hidden Transformers role remains one planets dangerous secrets invasion always feared enemy never expected moon spacecraft traitor shialabeouf johnmalkovich kenjeong michaelbay action sciencefiction adventure,/28YlCLrFhONteYSs9hKjD1Km0Cj.jpg,/h3js4rulxzKMOokM2oO5Kr0mBZU.jpg
188927,Star Trek Beyond,Star Trek Beyond USS Enterprise crew explores furthest reaches uncharted space encounter mysterious new enemy puts everything Federation stands test  sequel stranded hatred chrispine zacharyquinto karlurban justinlin action adventure sciencefiction,/yOnd3XQIg7JBmu0UuBjZyLdsxQD.jpg,/m4F1KRK5jAoQHi2mKDFE2jFKEIb.jpg
14161,2012,2012 Dr Adrian Helmsley part worldwide geophysical team investigating effect earth radiation unprecedented solar storms learns earths core heating up warns US President Thomas Wilson crust earth becoming unstable without proper preparations saving fraction worlds population entire race doomed Meanwhile writer Jackson Curtis stumbles information worlds leaders race build arks escape impending cataclysm Curtis struggles find way save family Meanwhile volcanic eruptions earthquakes unprecedented strength wreak havoc around world Warned civilization naturaldisaster endoftheworld johncusack amandapeet chiwetelejiofor rolandemmerich action adventure sciencefiction,/zaqam2RNscH5ooYFWInV6hjx6y5.jpg,/pvxmYJcgrLiYC6G2IQTn1PPNems.jpg
76757,Jupiter Ascending,Jupiter Ascending universe human genetic material precious commodity impoverished young Earth woman becomes key strategic maneuvers internal strife within powerful dynasty… Expand universe jupiter space womandirector milakunis channingtatum seanbean lillywachowski sciencefiction fantasy action,/xzQ25m9vrdyvpLX74T3B3KB40Ou.jpg,/eQEYPQ98cTjLDsFthbMswQ6UDuZ.jpg
246655,X-Men: Apocalypse,XMen Apocalypse reemergence worlds first mutant worlddestroyer Apocalypse XMen must unite defeat extinction level plan strong survive mutant supernaturalpowers marvelcomic jamesmcavoy michaelfassbender jenniferlawrence bryansinger sciencefiction,/2mtQwJKVKQrZgTz49Dizb25eOQQ.jpg,/2ex2beZ4ssMeOduLD0ILzXKCiep.jpg
1726,Iron Man,Iron Man held captive Afghan cave billionaire engineer Tony Stark creates unique weaponized suit armor fight evil Heroes born Theyre built middleeast armsdealer malibu robertdowneyjr terrencehoward jeffbridges jonfavreau action sciencefiction adventure,/78lPtwv72eTNqFW9COBYI0dWDJa.jpg,/cyecB7godJ6kNHGONFjUyVN9OX5.jpg
137113,Edge of Tomorrow,Edge Tomorrow Major Bill Cage officer never seen day combat unceremoniously demoted dropped combat Cage killed within minutes managing take alpha alien him awakens back beginning day forced fight die again  physical contact alien thrown time loop Live Die Repeat dejavu timewarp restart tomcruise emilyblunt brendangleeson dougliman action sciencefiction,/xjw5trHV7Mwo61P0kCTy8paEkgO.jpg,/4V1yIoAKPMRQwGBaSses8Bp2nsi.jpg
10138,Iron Man 2,Iron Man 2 world aware dual life armored superhero Iron Man billionaire inventor Tony Stark faces pressure government press public share technology military Unwilling let go invention Stark Pepper Potts James Rhodey Rhodes side must forge new alliances – confront powerful enemies armor makes hero man inside malibu marvelcomic superhero robertdowneyjr gwynethpaltrow doncheadle jonfavreau adventure action sciencefiction,/6WBeq4fCfn7AN0o21W9qNcRF2l9.jpg,/jesRqfL9v6HNnowe795xjmuKUXl.jpg
119450,Dawn of the Planet of the Apes,Dawn Planet Apes group scientists San Francisco struggle stay alive aftermath plague wiping humanity Caesar tries maintain dominance community intelligent apes One last chance peace leader colony postapocalyptic andyserkis jasonclarke garyoldman mattreeves sciencefiction action drama,/kScdQEwS9jPEdnO23XjGAtaoRcT.jpg,/zlU8BIkgY7E6SMfD3USTWC6bchL.jpg
79698,The Lovers,Lovers Lovers epic romance time travel adventure film Helmed Roland Joffé story Ajey Jhankar film sweeping tale impossible love set backdrop first AngloMaratha war across two time periods continents centred around four characters — British officer 18th century colonial India Indian woman falls deeply love with American presentday marine biologist wife Love longer life  joshhartnett simonekessell tamsinegerton rolandjoffé action adventure sciencefiction,/6esL8UH2sXXqbfbaV6bFEUBCDOr.jpg,/bHDQPPXx5hxkrg7oE9TJXrFHUSg.jpg
100402,Captain America: The Winter Soldier,Captain America Winter Soldier cataclysmic events New York Avengers Steve Rogers aka Captain America living quietly Washington DC trying adjust modern world SHIELD colleague comes attack Steve becomes embroiled web intrigue threatens put world risk Joining forces Black Widow Captain America struggles expose everwidening conspiracy fighting professional assassins sent silence every turn full scope villainous plot revealed Captain America Black Widow enlist help new ally Falcon However soon find unexpected formidable enemy—the Winter Soldier heroes trust washingtondc future shield chrisevans samuelljackson scarlettjohansson anthonyrusso action adventure sciencefiction,/tVFRpFw3xTedgPGqxW0AOI8Qhh0.jpg,/1RWLMyC9KcFfcaoViMiJGSSZzzr.jpg
47933,Independence Day: Resurgence,Independence Day Resurgence always knew coming back Using recovered alien technology nations Earth collaborated immense defense program protect planet nothing prepare us aliens’ advanced unprecedented force ingenuity brave men women bring world back brink extinction twenty years prepare they alternatehistory alieninvasion liamhemsworth jeffgoldblum billpullman rolandemmerich action adventure sciencefiction,/9S50foUIYGwiNPWOxi1WJF6IPwI.jpg,/jgiLc2X6OafvcadrNUaMeElgJrQ.jpg
296,Terminator 3: Rise of the Machines,Terminator 3 Rise Machines 10 years since John Connor saved Earth Judgment Day hes living radar steering clear using anything Skynet trace is encounters TX robotic assassin ordered finish T1000 started Good thing Connors former nemesis Terminator back aid nowadult Connor … like promised Machines Rise savingtheworld artificialintelligence manvsmachine arnoldschwarzenegger nickstahl clairedanes jonathanmostow action thriller sciencefiction,/qAnafzrd9Y5pVTWAP0tSDDMPzTR.jpg,/kbXMOnz2RhTSAbLtHX5hy5AXtwv.jpg
118340,Guardians of the Galaxy,Guardians Galaxy Light years Earth 26 years abducted Peter Quill finds prime target manhunt discovering orb wanted Ronan Accuser heroes start somewhere marvelcomic spaceship space chrispratt zoesaldana davebautista jamesgunn action sciencefiction adventure,/r7vmZjiyZw9rpJMQJdXpjgiCOk9.jpg,/uLtVbjvS1O7gXL8lUOwsFOH4man.jpg
157336,Interstellar,Interstellar Interstellar chronicles adventures group explorers make use newly discovered wormhole surpass limitations human space travel conquer vast distances involved interstellar voyage Mankind born Earth never meant die here savingtheworld artificialintelligence fathersonrelationship matthewmcconaughey jessicachastain annehathaway christophernolan adventure drama sciencefiction,/gEU2QniE6E77NI6lCU6MxlNBvIx.jpg,/rAiYTfKGqDCRIIqo664sY9XZIvQ.jpg
27205,Inception,Inception Cobb skilled thief commits corporate espionage infiltrating subconscious targets offered chance regain old life payment task considered impossible inception implantation another persons idea targets subconscious mind scene crime lossoflover dream kidnapping leonardodicaprio josephgordonlevitt ellenpage christophernolan action thriller sciencefiction,/edv5CZvWj09upOsy2Y6IwDhK8bt.jpg,/ztZ4vw151mw04Bg6rqJLQGBAmvn.jpg
49538,X-Men: First Class,XMen First Class Charles Xavier Erik Lensherr took names Professor X Magneto two young men discovering powers first time archenemies closest friends working together mutants some familiar new stop greatest threat world ever known Witness moment change world cia mutant mine jamesmcavoy michaelfassbender jenniferlawrence matthewvaughn action sciencefiction adventure,/vUvlOY575rztBuJV3a0dbHW5MQR.jpg,/bMiOfPhplZu1Lql3hGTRV087QA.jpg
131634,The Hunger Games: Mockingjay - Part 2,Hunger Games Mockingjay  Part 2 nation Panem full scale war Katniss confronts President Snow final showdown Teamed group closest friends – including Gale Finnick Peeta – Katniss goes mission unit District 13 risk lives stage assassination attempt President Snow become increasingly obsessed destroying her mortal traps enemies moral choices await Katniss challenge arena faced Hunger Games fire burn forever revolution strongwoman dystopia jenniferlawrence joshhutcherson liamhemsworth francislawrence action adventure sciencefiction,/lImKHDfExAulp16grYm8zD5eONE.jpg,/nKDvDVSaFFBrQr0NoPiyasEN8Mk.jpg
87101,Terminator Genisys,Terminator Genisys year 2029 John Connor leader resistance continues war machines Los Angeles offensive Johns fears unknown future begin emerge TECOM spies reveal new plot SkyNet attack fronts past future ultimately change warfare forever Reset future savingtheworld artificialintelligence cyborg arnoldschwarzenegger jasonclarke emiliaclarke alantaylor sciencefiction action thriller,/oZRVDpNtmHk8M1VYy1aeOWUXgbC.jpg,/g4a5YLWwi6OCp8TcvxsUNrXMbN5.jpg
1858,Transformers,Transformers Young teenager Sam Witwicky becomes involved ancient struggle two extraterrestrial factions transforming robots – heroic Autobots evil Decepticons Sam holds clue unimaginable power Decepticons stop nothing retrieve it war world destroy transformation alien shialabeouf joshduhamel meganfox michaelbay adventure sciencefiction action,/phAFhKOEhOGLIuH0brr5EenAckY.jpg,/77P56ZcL8M9Cw7FIptMIGjhNJoj.jpg
76341,Mad Max: Fury Road,Mad Max Fury Road apocalyptic story set furthest reaches planet stark desert landscape humanity broken everyone crazed fighting necessities life Within world exist two rebels run might able restore order Theres Max man action man words seeks peace mind following loss wife child aftermath chaos Furiosa woman action woman believes path survival may achieved make across desert back childhood homeland Lovely Day future chase postapocalyptic tomhardy charlizetheron nicholashoult georgemiller action adventure sciencefiction,/hA2ple9q4qnwxp3hKVNhroipsir.jpg,/8yACFuo4OaIiKr9hHFlmPcGalKx.jpg
95,Armageddon,Armageddon asteroid threatens collide Earth NASA honcho Dan Truman determines way stop drill surface detonate nuclear bomb leads renowned driller Harry Stamper agrees helm dangerous space mission provided bring along hotshot crew Among cocksure AJ Harry thinks good enough daughter mission proves otherwise Earths Darkest Day Mans Finest Hour savingtheworld paris moon brucewillis billybobthornton benaffleck michaelbay action thriller sciencefiction,/eTM3qtGhDU8cvjpoa6KEt5E2auU.jpg,/sODk4VuMTt8S56zYFOr1Kx8BFqu.jpg
13475,Star Trek,Star Trek fate galaxy rests hands bitter rivals One James Kirk delinquent thrillseeking Iowa farm boy other Spock Vulcan raised logicbased society rejects emotion fiery instinct clashes calm reason unlikely powerful partnership thing capable leading crew unimaginable danger boldly going one gone before human adventure begun again future begins spacecraft teleportation spacemission chrispine zacharyquinto leonardnimoy jjabrams sciencefiction action adventure,/9vaRPXj44Q2meHgt3VVfQufiHOJ.jpg,/q7M0JpPixbEYT8EhnI7wTEMONxz.jpg
13183,Watchmen,Watchmen gritty alternate 1985 glory days costumed vigilantes brought close government crackdown one masked veterans brutally murdered investigation killer initiated reunited heroes set prevent destruction uncover sinister plot puts humanity grave danger Justice coming us matter do dccomics secretidentity massmurder malinåkerman billycrudup carlagugino zacksnyder action mystery sciencefiction,/aZvOkdo203bm1kpcY0A0Tn074ER.jpg,/uOvNJMVy3VzEfS75hXroITSsdWY.jpg
1927,Hulk,Hulk Bruce Banner genetics researcher tragic past suffers massive radiation exposure laboratory causes transform raging green monster gets angry Unleash hero within california sanfrancisco monster ericbana jenniferconnelly samelliott anglee drama action sciencefiction,/qnngKqAcqfH2pBxDoKu5lxzSbTo.jpg,/kYd1ZMWvG9K2Jeop3XWXcTpJ2dB.jpg
72559,G.I. Joe: Retaliation,GI Joe Retaliation Framed crimes country GI Joe team terminated Presidential order forces GI Joes fighting mortal enemy Cobra forced contend threats within government jeopardize existence  terror assassin secret dwaynejohnson djcotrona adriannepalicki jonmchu adventure action sciencefiction,/3rWIZMzTKcCtV0eHJ70Z4Ru659f.jpg,/pEhXq18GVe1dg2ltplcxtGWfSje.jpg
1771,Captain America: The First Avenger,Captain America First Avenger Predominantly set World War II Steve Rogers sickly man Brooklyn whos transformed supersoldier Captain America aid war effort Rogers must stop Red Skull – Adolf Hitlers ruthless head weaponry leader organization intends use mysterious device untold powers world domination patriots become heroes newyork usa worldwarii chrisevans hugoweaving tommyleejones joejohnston action adventure sciencefiction,/vSNxAJTlD0r02V9sPYpOjqDZXUK.jpg,/4NWWpT0jiMUak8r6jfpvG4eBgFU.jpg
1724,The Incredible Hulk,Incredible Hulk Scientist Bruce Banner scours planet antidote unbridled force rage within him Hulk military masterminds dream exploiting powers force back civilization finds coming face face new deadly foe like hes angry newyork riodejaneiro marvelcomic edwardnorton livtyler timroth louisleterrier sciencefiction action adventure,/gKzYx79y0AQTL4UAk1cBQJ3nvrm.jpg,/xfBnQ4mgf1jYZsscJGJjr6ce0Ar.jpg
102899,Ant-Man,AntMan Armed astonishing ability shrink scale increase strength master thief Scott Lang must embrace innerhero help mentor Doctor Hank Pym protect secret behind spectacular AntMan suit new generation towering threats seemingly insurmountable obstacles Pym Lang must plan pull heist save world Heroes get bigger marvelcomic superhero basedoncomicbook paulrudd michaeldouglas evangelinelilly peytonreed sciencefiction action adventure,/8YxOIPrabqkQCOKKbuxaz9IcqhO.jpg,/a7sAqMKv5tkAdMzFfIhPqIBmQ9g.jpg
101299,The Hunger Games: Catching Fire,Hunger Games Catching Fire Katniss Everdeen returned home safe winning 74th Annual Hunger Games along fellow tribute Peeta Mellark Winning means must turn around leave family close friends embarking Victors Tour districts Along way Katniss senses rebellion simmering Capitol still much control President Snow prepares 75th Annual Hunger Games The Quarter Quell  competition could change Panem forever Every revolution begins spark competition basedonnovel mentor jenniferlawrence joshhutcherson liamhemsworth francislawrence adventure action sciencefiction,/vrQHDXjVmbYzadOXQ0UaObunoy2.jpg,/dIi0De3LzEVSQHEUlh0Q2zUpmeW.jpg
74,War of the Worlds,War Worlds Ray Ferrier divorced dockworker lessthanperfect father Soon exwife new husband drop teenage son young daughter rare weekend visit strange powerful lightning storm touches down Theyre already here posttraumaticstressdisorder newjersey airplane tomcruise dakotafanning mirandaotto stevenspielberg adventure thriller sciencefiction,/6Biy7R9LfumYshur3YKhpj56MpB.jpg,/nH6hPhJq3EEv9CnBZgXU3IQnpJo.jpg
82700,After Earth,Earth One thousand years cataclysmic events forced humanitys escape Earth Nova Prime become mankinds new home Legendary General Cypher Raige returns extended tour duty estranged family ready father 13yearold son Kitai asteroid storm damages Cypher Kitais craft crashland unfamiliar dangerous Earth father lies dying cockpit Kitai must trek across hostile terrain recover rescue beacon whole life Kitai wanted nothing soldier like father Today gets chance Danger real fear choice dystopia jadensmith willsmith sophieokonedo mnightshyamalan sciencefiction action adventure,/saJsA1eBEAqYVQuVrNQrK6NFFBD.jpg,/pfCp6OmgJW9YzqPRhCD7ItFSicb.jpg
131631,The Hunger Games: Mockingjay - Part 1,Hunger Games Mockingjay  Part 1 Katniss Everdeen reluctantly becomes symbol mass rebellion autocratic Capitol Fire burns brighter darkness resistance postapocalyptic dystopia jenniferlawrence joshhutcherson liamhemsworth francislawrence sciencefiction adventure thriller,/4FAA18ZIja70d1Tu5hr5cj2q1sB.jpg,/tFlSDoWQsAZ2qjICKzfP5Yw6zM5.jpg
36658,X2,X2 Professor Charles Xavier team genetically gifted superheroes face rising tide antimutant sentiment led Col William Stryker Storm Wolverine Jean Grey must join usual nemeses – Magneto Mystique – unhinge Strykers scheme exterminate mutants time come different stand united mutant marvelcomic superhero patrickstewart hughjackman ianmckellen bryansinger adventure action sciencefiction,/pwQo1ehiPBqAbiVqD6rfNM8GCFE.jpg,/loixNIKBURXfPcND4noz7E8FqCS.jpg
861,Total Recall,Total Recall Construction worker Douglas Quaid discovers memory chip brain virtualreality trip also finds past invented conceal plot planetary domination Soon hes Mars find planted chip stole mind wants back oxygen falselyaccused resistance arnoldschwarzenegger sharonstone rachelticotin paulverhoeven action adventure sciencefiction,/wVbeL6fkbTKSmNfalj4VoAUUqJv.jpg,/cE9Gtz5KEVkien4VDSgXjtwfcs.jpg
435,The Day After Tomorrow,Day Tomorrow years increases greenhouse effect havoc wreaked globally form catastrophic hurricanes tornadoes tidal waves floods beginning new Ice Age Paleoclimatologist Jack Hall tries warn world also shepherding safety son trapped New York city overwhelmed start new big freeze be ,/kNKy8eJemg6sCAMBgh4xrD0lleX.jpg,/fXJhA3pjLMDkHPgZ2GVhRDXA5M3.jpg
70981,Prometheus,Prometheus team explorers discover clue origins mankind Earth leading journey darkest corners universe There must fight terrifying battle save future human race Search Beginning Could Lead End android dystopia alien noomirapace michaelfassbender guypearce ridleyscott sciencefiction adventure mystery,/m7nZCtHJyDLncBUarfM5h5mrppx.jpg,/hO97RyNjBIMfzfFpUjNhsm4zImh.jpg
68724,Elysium,Elysium year 2159 two classes people exist wealthy live pristine manmade space station called Elysium rest live overpopulated ruined Earth Secretary Rhodes Jodie Foster hard line government ofﬁcial stop nothing enforce antiimmigration laws preserve luxurious lifestyle citizens Elysium doesn’t stop people Earth trying get in means can unlucky Max Matt Damon backed corner agrees take daunting mission that successful save life could bring equality polarized worlds save us all dystopia spacestation classconflict mattdamon jodiefoster sharltocopley neillblomkamp sciencefiction action drama,/aRjuJuPXHtVs6YegfeeQWXGRs1E.jpg,/xjnxyYqsgRDF9NmuNF19kHHu0Yg.jpg
2789,The Chronicles of Riddick,Chronicles Riddick years outrunning ruthless bounty hunters escaped convict Riddick suddenly finds caught opposing forces fight future human race Now waging incredible battles fantastic deadly worlds lone reluctant hero emerge humanitys champion  last hope universe edge annihilation power universe cant change destiny prison dystopia matteroflifeanddeath vindiesel thandienewton karlurban davidtwohy action sciencefiction,/iSaB7jBgsU6sXqKneZpdeRw5MSV.jpg,/lt3NqorBMWn786m9bzqM0OLdMS8.jpg
